0,8558,東和銀行,0,27,1000,http://www.towabank.co.jp/,1942-09-30,1990-02-01,3,群馬、埼玉中心に店舗展開する第二地銀。財務・顧客基盤を強化中。\n第二地銀。群馬２番手。埼玉、東京にも展開。損失処理終え財務基盤強化中。公的資金３５０億円
0,8559,豊和銀行,11,27,0,http://www.howabank.co.jp/,1949-12-22,1990-12-12,3,大分地盤の第２地銀。地域密着型で個人ローン比率大。公的資金申請行。\n大分の第二地銀で西日本シティと親密。個人融資比率高い。金融機能強化法の公的資金注入行
0,8560,宮崎太陽銀行,11,27,0,http://www.taiyobank.co.jp/,1941-08-01,1990-12-14,3,宮崎地盤の第２地銀。隣県にも展開。リテール軸に中小育成。堅実経営。\n宮崎県地盤、隣県も展開。第二地銀。県内貸出シェアは２割弱。１０年に公的資金で資本強化
0,8562,福島銀行,0,27,1000,http://www.fukushimabank.co.jp/,1922-11-27,1992-10-22,3,福島県地盤の第二地銀。仙台や北関東にも進出。再生支援を強化。\n福島県内２位級。取引先企業の拡大と再生支援を強化。個人向けはシニア層の取引拡充に力点
0,8563,大東銀行,0,27,1000,http://www.daitobank.co.jp/,1942-08-18,1992-12-10,3,福島県地盤の第二地銀。中小企業や個人が主力。収益強化が課題。\n福島県内資金量２位。郡山本拠、県全域展開。中小企業、個人に強み。復興支援強化で営業改革
0,8600,トモニホールディングス,0,27,100,http://www.tomony-hd.co.jp/,2010-04-01,2010-04-01,3,香川銀と徳島銀が統合し発足。大阪や岡山など店舗の広域化を推進。\n銀行持株会社。傘下に徳島銀行と香川銀行。大阪、岡山などへ店舗ネットワークの広域化推進中
0,8648,バンカメリカ,5,27,10,"",1968-07-03,1987-07-01,12,米国南東部で最大の銀行持株会社。\n-
0,8710,シティグループ・インク,5,27,1,"",1998-10-08,2007-11-05,12,世界最大の金融グループ\n-
0,8713,フィデアＨＤ,0,27,100,http://www.fidea.co.jp/,2009-10-01,2009-10-01,3,荘内銀と北都銀が県を超えて統合。山形・秋田が地盤。公的資金残る。\n山形の荘内銀と秋田の北都銀が統合。本社は仙台。他地銀の合流に前向き。公的資金１００億円
0,8714,池田泉州ＨＤ,0,27,100,http://www.senshuikeda-hd.co.jp/,2009-10-01,2009-10-01,3,池田銀と泉州銀が経営統合。関西地盤、大阪府内で最大。独立系標榜。\n関西地盤の池田銀行と泉州銀行が経営統合。アライアンス戦略を推進。傘下に証券子会社
