日本水産,日本水産、大阪港に大型冷蔵施設 物流受託を強化日本水産／72億円投じ、大阪・舞洲に物流センター来年4月稼働日本水産／日水物流・大阪舞洲物流センターを新設日本水産、72億円投じ大阪･舞洲に低温物流拠点,http://www.nikkei.com/article/DGXLASDZ15HWG_V10C15A9TI5000/,日本経済新聞,2015-09-15
日本水産,【ミラノ万博】 福島、食の安全アピール 品質管理への取り組み紹介,http://www.sankei.com/world/news/151012/wor1510120035-n1.html,産経ニュース,2015-10-12
日本水産,コロチキ、コント日本一に喜び! 松本人志の高評価に「信じられない」と感激,http://news.mynavi.jp/news/2015/10/12/039/,マイナビニュース,2015-10-12
日本水産,【TPPインパクト】日本茶は追い風か？,https://newswitch.jp/p/2311,ニュースイッチ Newswitch,2015-10-12
日本水産,「サンマつかみ取り」に歓声 銚子水産まつりに３万３０００人,http://www.sankei.com/region/news/151012/rgn1510120035-n1.html,産経ニュース,2015-10-12
日本水産,主張TPP大筋合意 農業や中小企業 影響を最小限に,https://www.komei.or.jp/news/detail/20151012_18232,公明新聞,2015-10-12
日本水産,日本と台湾・中国との間でサンマ戦争勃発,http://japan.hani.co.kr/arti/international/22188.html,The Hankyoreh japan (風刺記事) (プレスリリース),2015-10-12
日本水産,石田祝稔 政務調査会長 新任党幹部の横顔石田祝稔 政務調査会長,https://www.komei.or.jp/news/detail/20151012_18234,公明新聞,2015-10-12
日本水産,＜女川町長選＞観光・起業 新たな試み,http://www.kahoku.co.jp/tohokunews/201510/20151012_11013.html,河北新報,2015-10-12
日本水産,フードバンク：企業から食品提供受け施設へ 全国に広がる,http://mainichi.jp/select/news/20151011k0000e040097000c.html,毎日新聞,2015-10-11
日本水産,新朝鮮通信使：日韓５０人自転車で目指す東京 ソウル出発,http://mainichi.jp/select/news/20151012k0000m040057000c.html,毎日新聞,2015-10-11
日本水産,農水省 ＴＰＰ大筋合意でコメの国内対策検討へ,http://www3.nhk.or.jp/news/html/20151010/k10010265851000.html,NHK,2015-10-10
日本水産,ＴＰＰ交渉の決着を受けて,http://blogos.com/article/138599/,BLOGOS,2015-10-11
日本水産,第３次安倍改造内閣が始動,http://www3.nhk.or.jp/news/html/20151008/k10010262981000.html,NHK,2015-10-08
日本水産,海の砂漠！ 「磯焼け」の謎に迫る,http://news.mynavi.jp/news/2015/10/06/554/,マイナビニュース,2015-10-06
日本水産,米国に日本市場明け渡す暴挙,http://www.h5.dion.ne.jp/‾chosyu/beikokuninihonsijouakewaatasuboukyo.html,長周新聞,2015-10-11
日本水産,体質強化策万全に 農水省本部も初会合 ＴＰＰ総合対策本部,http://www.agrinews.co.jp/modules/pico/index.php?content_id=34961,日本農業新聞,2015-10-10
日本水産,ニュースウィークリー】１０月４日〜１０月１０日,http://www.miyakomainichi.com/2015/10/81369/,宮古毎日新聞,2015-10-11
日本水産,林農相「コメの価格に影響しない対策とる」,http://www3.nhk.or.jp/news/html/20151006/k10010260591000.html,NHK,2015-10-06
日本水産,ＴＰＰ 酪農家から不安の声 北海道への影響懸念,http://www3.nhk.or.jp/news/html/20151006/k10010260581000.html,NHK,2015-10-06
日本水産,経済再生相が会見「大きな戦略的な意義」ＴＰＰ大筋合意 県対策会議、農畜産業支援を検討 各会派「票離れ」危惧 ...米の米国・豪州向け特別枠−ＴＰＰ大筋合意TPP大筋合意、家計への影響は? - コメの国別輸入枠新設、バター不足 ...日本農業新聞,http://www3.nhk.or.jp/news/html/20151006/k10010260011000.html,NHK,2015-10-06
日本水産,日本水産、エビを陸上養殖 安定調達へ大手本格参入,http://www.nikkei.com/article/DGXLASDZ25I2A_W5A520C1TI5000/,日本経済新聞,2015-05-26
日本水産,県、ＴＰＰ対策チーム 農林水産分野の影響分析 2015年10月07日まだ「最終合意」ではないＴＰＰ,http://www.yomiuri.co.jp/local/yamaguchi/news/20151006-OYTNT50359.html,読売新聞,2015-10-07
日本水産,フィード・ワン、北九州に国内最大級の水産飼料工場,http://www.nikkei.com/article/DGXLASDZ05I1B_V01C15A0TJC000/,日本経済新聞,2015-10-05
日本水産,【第３次安倍改造内閣】閣僚の横顔（中）「レンジャー隊員」「女ヤジ将軍 ...,http://www.sankei.com/politics/news/151007/plt1510070051-n1.html,産経ニュース,2015-10-07
日本水産,食品流通 ニュース詳細,http://www.jacom.or.jp/ryutsu/news/2015/10/151009-28253.php,農業協同組合新聞,2015-10-09
日本水産,日本株は７日ぶり反落、小売など内需安い−下期不透明感と連騰反動,http://www.bloomberg.co.jp/news/123-NVVGBC6K50XU01.html,ブルームバーグ,2015-10-08
日本水産,SFPダイニング<3198>活気のある日本の居酒屋として外国人にも人気,http://zuuonline.com/archives/84545,ZUU online,2015-10-08
日本水産,日本水産 【1332】、今期経常は14％減益、前期配当を3期ぶり3円で復配 ...,http://kabutan.jp/news/?b=k201505150034,株探ニュース,2015-05-14
日本水産,森山農水相、ＴＰＰ「牛・豚肉の生産者に一定の影響」,http://news.tbs.co.jp/newseye/tbs_newseye2607254.html,TBS News,2015-10-08
日本水産,「国会決議は守れた」−森山新農相農水相、ＴＰＰ大筋合意で国内対策急ぐ考え,http://www.jacom.or.jp/nousei/news/2015/10/151008-28246.php,農業協同組合新聞,2015-10-08
日本水産,日本株は素材、資源中心上昇、流動性期待とＴＰＰ−指数伸び悩みも,http://www.bloomberg.co.jp/news/123-NVRR0I6K50Y901.html,ブルームバーグ,2015-10-06
日本水産,サンマ漁獲制限、有効な枠組み作りには時間 2015年10月05日 09時10分,http://www.yomiuri.co.jp/economy/20151005-OYT1T50038.html,読売新聞,2015-10-04
日本水産,大阪）温暖化の農作物影響、新装置で調査 府立研究所,http://www.asahi.com/articles/ASH9J3HFDH9JPPTB004.html,asahi.com,2015-10-07
日本水産,【朗報！】10/10は「魚(とと)（1010）屋(や)路(みち)の日」「まぐろの日」 10 ...,http://www.yomiuri.co.jp/adv/komachi/release/00015696.html,読売新聞,2015-10-08
日本水産,リンゴ、オレンジも関税撤廃＝国内生産者に影響へ−ＴＰＰ合意の追加 ...,http://www.jiji.com/jc/zc?k=201510/2015100800965&g=eco,時事通信,2015-10-08
日本水産,日本水産 【1332】、未定だった今期配当は3期ぶり3円で復配,http://kabutan.jp/news/?b=k201503190007,株探ニュース,2015-03-18
日本水産,中国産アナゴを「日本海産」と偽装（後）,http://www.data-max.co.jp/20151006_dm1934_01/,NET-IB NEWS,2015-10-06
日本水産,＜アナゴ産地偽装＞「国産品薄だった」 2015年10月02日中国アナゴ、国産と偽装 島根の会社に改善指示偽装販売：中国産「アナゴ」、国産に 県が改善指示 ／島根島根県、産地偽造で水産加工品製造会社に改善指示・中国産の穴子を ...,http://www.yomiuri.co.jp/local/shimane/news/20151001-OYTNT50123.html,読売新聞,2015-10-01
日本水産,国内対策 着手へ 全閣僚メンバー「総合本部」設置 ＴＰＰ大筋合意で首相,http://www.agrinews.co.jp/modules/pico/index.php?content_id=34921,日本農業新聞,2015-10-07
日本水産,TPP発効に期待大、繊維・縫製、水産、木製品分野の各企業,http://www.viet-jo.com/news/economy/151007081428.html,日刊ベトナムニュース,2015-10-07
日本水産,国内大手証券、食品・日用品では明治ＨＤ、キッコーマン、味の素、日清 ...,http://kabutan.jp/news/marketnews/?b=n201510050266,株探ニュース,2015-10-04
日本水産,日本水産は急落前の水準回復まで余裕あり好業績など見直し７％高,http://biz.searchina.net/id/1587468,サーチナ,2015-09-02
日本水産,防げるか、台湾・中国の「サンマ先取り」 編集委員 志田富雄,http://www.nikkei.com/article/DGXMZO92219280Z20C15A9000000/,日本経済新聞,2015-10-03
日本水産,日本版「共有価値創造（CSV）」戦略の決定版！『協創力が稼ぐ時代 ...,http://www.sankei.com/economy/news/151006/prl1510060110-n1.html,産経ニュース,2015-10-06
日本水産,関税撤廃、オレンジ８年目 ＴＰＰ、農林水産物の半数に,https://www.okinawatimes.co.jp/article.php?id=136395,沖縄タイムス,2015-10-09
日本水産,電通時代〈2〉 営業局長就任,http://dentsu-ho.com/articles/2953,電通報,2015-09-19
日本水産,日本水産／4〜6月、純利益59.6％増,http://makernews.biz/201508055519-2/,メーカーニュース,2015-08-04
日本水産,韓国料理で心も体も温まるショートWebドラマ『愛ある食卓』公開,http://prtimes.jp/main/html/rd/p/000000001.000015646.html,PR TIMES (プレスリリース),2015-10-07
日本水産,メロン生産量日本一の深作農園内「LE・FUKASAKU(ル・フカサク)」メロン生産量日本一の深作農園、農水省の六次産業化法認定を受け ...,https://www.atpress.ne.jp/news/76843,＠Press (プレスリリース),2015-10-08
日本水産,日本の水産専門家、マグロ漁船に乗り込み設備の使用方法を指導,http://www.hotnam.com/news/151008033749.html,HOTNAM！,2015-10-08
日本水産,ハーベスト フェス powered by 農業女子ＰＪ,http://www.sankei.com/economy/news/151002/prl1510020237-n1.html,産経ニュース,2015-10-02
日本水産,放牧を活用した繁殖基盤強化に関する「全国肉用牛放牧シンポジウム ...,http://www.jacom.or.jp/niku/news/2015/10/151006-28218.php,農業協同組合新聞,2015-10-06
日本水産,日本水産、医薬原料を増産 新工場に80億円投資,http://www.nikkei.com/article/DGXLZO85284020T00C15A4TJ1000/,日本経済新聞,2015-04-03
日本水産,「2015ジャパン・ケーキショー東京」作品展―全入賞者掲載,http://www.gateaux.or.jp/c/gateaux/151005.html,日本洋菓子協会連合会ニュース,2015-10-06
日本水産,今後選びたい住宅、在来工法の木造住宅が５１．９％、農水省調査,http://www.s-housing.jp/archives/79321,新建ハウジング,2015-10-09
日本水産,サンマが大ピンチ！中国・台湾の乱獲に無力な日本,http://diamond.jp/articles/-/78431,ダイヤモンド・オンライン,2015-09-14
日本水産,セントラルスポーツと日本水産はEPAに着目したオリジナルサプリメントを ...,http://www.zaikei.co.jp/article/20150804/262485.html,財経新聞,2015-08-03
日本水産,苫小牧産マツカワ 販路拡大へ試験輸出,http://www.tomamin.co.jp/20151030902,苫小牧民報,2015-10-09
日本水産,かつお節、海を越えて仏へ 生産日本一の鹿児島・枕崎の業者、規制逆手 ...,http://www.sankei.com/west/news/150915/wst1509150010-n1.html,産経ニュース,2015-09-14
日本水産,日本株連騰、海外景気懸念の後退と追加緩和期待−輸出、リフレ上げる,http://www.bloomberg.co.jp/news/123-NVIHQT6JIJV001.html,ブルームバーグ,2015-09-30
日本水産,世界に「日本食」８万店 ブーム追い風、大幅に増加,http://www.sankei.com/life/news/150922/lif1509220016-n1.html,産経ニュース,2015-09-22
日本水産,日本水産、30年ぶり新船 カツオ遠洋漁業,http://www.nikkei.com/article/DGXLZO85879230Z10C15A4TJC000/,日本経済新聞,2015-04-19
日本水産,マグロの持続可能な利用を資源保護と完全養殖で目指す キハダ稚魚の ...,http://www.jst.go.jp/pr/announce/20150924/,科学技術振興機構,2015-09-23
日本水産,【インタビュー】農林水産事務次官 本川一善氏 農業所得の向上を目的に ...,http://www.jacom.or.jp/noukyo/tokusyu/2015/09/150930-28175.php,農業協同組合新聞,2015-09-29
日本水産,『大きな大きな焼きおにぎり』新テレビＣＭ放映日本水産、「大きな大きな焼きおにぎり」鈴木砂羽が松崎しげるの歌声に ...,http://prtimes.jp/main/html/rd/p/000000011.000004805.html,PR TIMES (プレスリリース),2015-04-15
日本水産,日ロが初のクジラ合同調査 推定資源のデータ補強,http://dd.hokkaido-np.co.jp/news/science/science/1-0187690.html,北海道新聞,2015-10-06
日本水産,林芳正・前農水大臣 党でも引き続き政策支援,https://news.nissyoku.co.jp/news/detail/?id=ITO20151007044240383&cc=01&ic=015,食の情報源,2015-10-09
日本水産,メディアで多数の記事になった注目のプレスリリース,https://www.atpress.ne.jp/news/75955,＠Press (プレスリリース),2015-10-07
日本水産,農林水産被害２４８億円 作物損傷１万７８１３ヘクタール １８日現在 関東 ...,http://www.agrinews.co.jp/modules/pico/index.php?content_id=34774,日本農業新聞,2015-09-24
日本水産,禁輸解除「時間かかる」＝日本の水産物−韓国高官,http://www.jiji.com/jc/zc?k=201510/2015100800822&g=eco,時事通信,2015-10-08
日本水産,農林水産１１７億円 農相「全容把握まだ」 関東・東北豪雨被害,http://www.agrinews.co.jp/modules/pico/index.php?content_id=34711,日本農業新聞,2015-09-18
日本水産,「みなと塩竈・ゆめ博」10月1〜31日に初開催（塩釜商工会議所）,http://www.jcci.or.jp/news/local-front/2015/0930093812.html,日本商工会議所,2015-09-29
日本水産,長江の棚田、荒涼…今や耕作１軒 １６年前「百選」入り,http://www.chunichi.co.jp/article/aichi/20150917/CK2015091702000048.html,中日新聞,2015-09-16
日本水産,会見する森山農林水産相,http://news.biglobe.ne.jp/domestic/1008/jjp_151008_1748747339.html,BIGLOBEニュース,2015-10-08
日本水産,日本の食肉業界への支援で、神戸牛熟成肉のフルコースを食べよう！...,https://www.value-press.com/pressrelease/150202,ValuePress! (プレスリリース),2015-10-09
日本水産,【銘柄フラッシュ】日本水産など急伸し新規上場のエスケーホームは好発進,http://www.zaikei.co.jp/article/20150805/262780.html,財経新聞,2015-08-05
日本水産,【千葉発！世界の胃袋へ】規制解除のマレーシア、タイに活路,http://www.sankei.com/region/news/150922/rgn1509220052-n1.html,産経ニュース,2015-09-21
日本水産,【ミラノ万博】日本館第2の拠点 「ジャパンサローネ」,http://dentsu-ho.com/articles/3052,電通報,2015-09-13
日本水産,＜後場の注目銘柄＞＝ニチモウ、材料株の真骨頂発揮へ,http://kabutan.jp/news/marketnews/?b=n201509160198,株探ニュース,2015-09-15
日本水産,農林水産被害、117億円に拡大 関東・東北豪雨,http://www.nikkei.com/article/DGXLASFS18H4V_Y5A910C1EE8000/,日本経済新聞,2015-09-18
日本水産,ニチモウに投機資金流入、低ＰＢＲと増額期待で材料株素地開花,http://kabutan.jp/news/marketnews/?b=n201509140097,株探ニュース,2015-09-13
日本水産,食品企業 インバウンド消費に積極対応−日本公庫調査,http://www.jacom.or.jp/ryutsu/news/2015/09/150929-28161.php,農業協同組合新聞,2015-09-28
日本水産,ノリ種付け１４日解禁 有明海漁協,http://www.saga-s.co.jp/news/saga/10101/235818,佐賀新聞,2015-10-02
日本水産,【ミラノ万博】「ジャパンサローネ」での食文化の発信（前編）,http://dentsu-ho.com/articles/3072,電通報,2015-09-14
日本水産,「新たな育種技術（NPBT）研究会」 農林水産省 報告書を取り纏め公表,http://www.jacom.or.jp/saibai/news/2015/09/150916-28087.php,農業協同組合新聞,2015-09-15
日本水産,生分解性プラスチックと分解酵素の活用シンポジウム 酵素処理ですぐに ...,http://www.niaes.affrc.go.jp/sinfo/sympo/h27/20151113.html,農業環境技術研究所,2015-09-30
日本水産,日本水産、大阪港に大型冷蔵施設 物流受託を強化日本水産／72億円投じ、大阪・舞洲に物流センター来年4月稼働日本水産／日水物流・大阪舞洲物流センターを新設日本水産、72億円投じ大阪･舞洲に低温物流拠点,http://www.nikkei.com/article/DGXLASDZ15HWG_V10C15A9TI5000/,日本経済新聞,2015-09-15
日本水産,【ミラノ万博】 福島、食の安全アピール 品質管理への取り組み紹介,http://www.sankei.com/world/news/151012/wor1510120035-n1.html,産経ニュース,2015-10-12
日本水産,コロチキ、コント日本一に喜び! 松本人志の高評価に「信じられない」と感激,http://news.mynavi.jp/news/2015/10/12/039/,マイナビニュース,2015-10-12
日本水産,【TPPインパクト】日本茶は追い風か？,https://newswitch.jp/p/2311,ニュースイッチ Newswitch,2015-10-12
日本水産,「サンマつかみ取り」に歓声 銚子水産まつりに３万３０００人,http://www.sankei.com/region/news/151012/rgn1510120035-n1.html,産経ニュース,2015-10-12
日本水産,主張TPP大筋合意 農業や中小企業 影響を最小限に,https://www.komei.or.jp/news/detail/20151012_18232,公明新聞,2015-10-12
日本水産,日本と台湾・中国との間でサンマ戦争勃発,http://japan.hani.co.kr/arti/international/22188.html,The Hankyoreh japan (風刺記事) (プレスリリース),2015-10-12
日本水産,石田祝稔 政務調査会長 新任党幹部の横顔石田祝稔 政務調査会長,https://www.komei.or.jp/news/detail/20151012_18234,公明新聞,2015-10-12
日本水産,＜女川町長選＞観光・起業 新たな試み,http://www.kahoku.co.jp/tohokunews/201510/20151012_11013.html,河北新報,2015-10-12
日本水産,フードバンク：企業から食品提供受け施設へ 全国に広がる,http://mainichi.jp/select/news/20151011k0000e040097000c.html,毎日新聞,2015-10-11
日本水産,農水省 ＴＰＰ大筋合意でコメの国内対策検討へ,http://www3.nhk.or.jp/news/html/20151010/k10010265851000.html,NHK,2015-10-10
日本水産,新朝鮮通信使：日韓５０人自転車で目指す東京 ソウル出発,http://mainichi.jp/select/news/20151012k0000m040057000c.html,毎日新聞,2015-10-11
日本水産,ＴＰＰ交渉の決着を受けて,http://blogos.com/article/138599/,BLOGOS,2015-10-11
日本水産,日本水産、大阪港に大型冷蔵施設 物流受託を強化日本水産／72億円投じ、大阪・舞洲に物流センター来年4月稼働日本水産／日水物流・大阪舞洲物流センターを新設日本水産、72億円投じ大阪･舞洲に低温物流拠点,http://www.nikkei.com/article/DGXLASDZ15HWG_V10C15A9TI5000/,日本経済新聞,2015-09-15
日本水産,自民党ポスター「ウソつかない。ＴＰＰ断固反対。ブレない。」の結果,http://www.huffingtonpost.jp/yuichiro-tamaki/tpp-agriculture_b_8283352.html,ハフィントンポスト,2015-10-14
日本水産,世界が注目する日本の“だし文化” 手軽でおいしい本格派“カップうどん ...,http://www.oricon.co.jp/special/48293/,ORICON STYLE,2015-10-14
日本水産,日本株は大幅続落、世界経済懸念強く１万8000円割れ−輸出、素材中心,http://www.bloomberg.co.jp/bb/newsarchive/NW6KJ36KLVS301.html,ブルームバーグ,2015-10-14
日本水産,スマホで農作物の生育・環境関連データ監視 IoT機器販売へ消費者にとっては大歓迎県内生産者の不安増大 「寝耳に水だ」危機感も,http://www.huffingtonpost.jp/science-portal/iot-agriculture_b_8283304.html,ハフィントンポスト,2015-10-14
日本水産,本日の【業種】騰落ランキング ＝ 大引け 【上昇トップ】水産・農林業 【下落 ...,http://kabutan.jp/news/marketnews/?b=n201510140252,株探ニュース,2015-10-14
日本水産,TPP大筋合意優先で交渉は国益放棄 日本の損害は1兆円超に,http://dot.asahi.com/wa/2015101300113.html,dot.,2015-10-14
日本水産,魚好きの大人になってね 築地市場と魚屋、料理を給食に,http://www.asahi.com/articles/ASHB83PGYHB8UCLV006.html,朝日新聞,2015-10-13
日本水産,クリレスＨＤが続伸、居酒屋「磯丸水産」牽引し今期経常益６割増と報じ ...,http://kabutan.jp/news/marketnews/?b=n201510140073,株探ニュース,2015-10-14
日本水産,“寿司”“ワサビ”も使用禁止!? 韓国政府の異常な日本語撤廃政策に ...韓国政府が推し進める日本語撤廃政策 韓国国民からも支持得られず？,http://tocana.jp/2015/10/post_7583_entry.html,TOCANA (風刺記事) (プレスリリース),2015-10-14
日本水産,外国人に人気！“だし”のうま味を堪能できるカップうどん・そば,http://www.sponichi.co.jp/society/news/2015/10/14/kiji/K20151014011314310.html,スポーツニッポン,2015-10-14
日本水産,ＴＰＰ大筋合意内容、全国で説明会 農業分野別、札幌はあすから,http://dd.hokkaido-np.co.jp/news/economy/economy/1-0190189.html,北海道新聞,2015-10-14
日本水産,ＴＰＰの品目別説明会、15日から全国で開催,http://www.nikkei.com/article/DGXLASFS13H31_T11C15A0EE8000/,日本経済新聞,2015-10-13
日本水産,日本株反落、原油安の鉱業や輸出、金融売り−１カ月ぶり高値の反動も,http://www.bloomberg.co.jp/news/123-NW4PVN6JTSEQ01.html,ブルームバーグ,2015-10-13
日本水産,日本の伝統行事に興味ある？どんなものに参加したい？,http://news.mynavi.jp/news/2015/10/13/429/,マイナビニュース,2015-10-13
日本水産,今週の永田町(2015.10.9〜13),http://getnews.jp/archives/1192744,ガジェット通信,2015-10-14
日本水産,刻む記憶：ノルウェー 極北の海に「怪物」現わる,http://mainichi.jp/area/tokushima/news/20151014ddlk36040608000c.html,毎日新聞,2015-10-14
日本水産,【速報】日本産牛肉のミャンマーへの輸出が可能に,http://myanmarjapon.com/newsdigest/2015/10/14-000869.php,MYANMAR JAPON（ミャンマージャポン）,2015-10-14
日本水産,ＬＰＳから農業法人への投資決定 11社・総額1億6400万 日本公庫,http://www.jacom.or.jp/kinyu/news/2015/10/151013-28259.php,農業協同組合新聞,2015-10-13
日本水産,【ニッスイ×宝島社】女子向けパッケージを共同開発！人気女性誌『sweet ...,http://prtimes.jp/main/html/rd/p/000000221.000005069.html,PR TIMES (プレスリリース),2015-09-29
日本水産,日本水産、大阪港に大型冷蔵施設 物流受託を強化日本水産／72億円投じ、大阪・舞洲に物流センター来年4月稼働日本水産／日水物流・大阪舞洲物流センターを新設日本水産、72億円投じ大阪･舞洲に低温物流拠点,http://www.nikkei.com/article/DGXLASDZ15HWG_V10C15A9TI5000/,日本経済新聞,2015-09-15
日本水産,「和牛」—「WAGYU」の登場で新時代に突入,http://www.nippon.com/ja/features/h00122/,nippon.com,2015-10-15
日本水産,ＴＰＰ対策で特別決議＝安倍首相「責任持ち実行」—ＪＡ全国大会,http://jp.wsj.com/articles/JJ11835287475029813344018207010031690767518,ウォール・ストリート・ジャーナル日本版,2015-10-15
日本水産,「ＴＰＰ大筋合意」とは何たることか！抗議する！！,http://www.jacom.or.jp/nousei/tokusyu/2015/10/151015-28287.php,農業協同組合新聞,2015-10-15
日本水産,ジェトロセミナー、食品・酒メーカーに“攻略法” 山梨県産桃の甘み、香港に ...,http://www.sankei.com/region/news/151015/rgn1510150059-n1.html,産経ニュース,2015-10-15
日本水産,指名停止業者から献金 森山農相側に計690万円,http://www.nikkei.com/article/DGXLASDG14H8P_U5A011C1000000/,日本経済新聞,2015-10-15
日本水産,ミャンマーに太陽光マイクログリッド、ラオス企業が構築,http://techon.nikkeibp.co.jp/atcl/news/15/101400732/,日経テクノロジーオンライン,2015-10-15
日本水産,自民党ポスター「ウソつかない。ＴＰＰ断固反対。ブレない。」の結果,http://www.huffingtonpost.jp/yuichiro-tamaki/tpp-agriculture_b_8283352.html,ハフィントンポスト,2015-10-14
日本水産,農林水産物の生産流通で先端技術事業,http://www.kagakukogyonippo.com/headline/2015/10/15-22146.html,ヘッドライン ニュース,2015-10-15
日本水産,日経平均が1万8000円割れの大幅続落、米企業決算に警戒感日経平均は大幅続落、1万8000円割れ 米企業決算に警戒感,http://www.newsweekjapan.jp/stories/business/2015/10/18000.php,Newsweekjapan,2015-10-14
日本水産,世界が注目する日本の“だし文化” 手軽でおいしい本格派“カップうどん ...,http://www.oricon.co.jp/special/48293/,ORICON STYLE,2015-10-14
日本水産,ＴＰＰにあらためて反対します−−生活クラブ生協連合会が声明を発表 ...ＴＰＰにあらためて反対を表明 生活クラブ生協連,http://www.sankei.com/economy/news/151015/prl1510150002-n1.html,産経ニュース,2015-10-15
日本水産,ＴＰＰ〜中川氏に説明求める 十勝組合長会が意見交換 東京,http://www.tokachi.co.jp/news/201510/20151015-0022036.php,十勝毎日新聞,2015-10-15
日本水産,スマホで農作物の生育・環境関連データ監視 IoT機器販売へ消費者にとっては大歓迎県内生産者の不安増大 「寝耳に水だ」危機感も,http://www.huffingtonpost.jp/science-portal/iot-agriculture_b_8283304.html,ハフィントンポスト,2015-10-14
