日本水産,安倍首相が後継指名？ 稲田朋美政調会長に「TPPは日本の墓場」と反対 ...,http://biz-journal.jp/2015/10/tpp.html,Business Journal (風刺記事) (プレスリリース),2015-10-14
日本水産,飲酒・喫煙だけじゃない！あなたの健康寿命をグーンと下げてしまうNG ...,http://news.mynavi.jp/news/2015/10/14/748/,マイナビニュース,2015-10-15
日本水産,【岩手】三陸のイケメン漁師活写 カレンダーデビュー,http://www.oricon.co.jp/news/2060769/,ORICON STYLE,2015-10-15
日本水産,日本株は大幅続落、世界経済懸念強く１万8000円割れ−輸出、素材中心,http://www.bloomberg.co.jp/bb/newsarchive/NW6KJ36KLVS301.html,ブルームバーグ,2015-10-14
日本水産,マイナンバー制度により少額の税逃れもNGに ここまで透明化する,http://news.mynavi.jp/news/2015/10/15/221/,マイナビニュース,2015-10-15
日本水産,TPP大筋合意優先で交渉は国益放棄 日本の損害は1兆円超に,http://dot.asahi.com/wa/2015101300113.html,dot.,2015-10-14
