0,3398,クスリのアオキ,0,26,100,http://www.kusuri-aoki.co.jp/,1985-01-26,2006-02-17,520,ドラッグストア中堅。北陸3県で首位。長野や岐阜にも展開。調剤併設店拡大。\n北陸最大手のドラッグストア。長野、新潟、岐阜などにも進出。イオン系。調剤併設店を拡大中
0,3399,丸千代山岡家,2,26,100,http://www.yamaokaya.com/,1993-03-08,2006-02-17,1,豚骨ラーメンチェーン。北海道と関東地盤で幹線沿いに展開。店舗でスープ手作り。\n北海道と北関東地盤のラーメンチェーン。幹線道路沿いに展開。手作りスープ等店舗作業多い
0,3415,ＳＴＵＤＩＯＵＳ,4,26,100,http://www.studious.co.jp/,2008-12-12,2015-09-02,2,衣料品のセレクトショップ「STUDIOS」と「UNITED TOKYO」を展開。\n国内ブランド特化型のセレクトショップと独自ブランド「ＵＮＩＴＥＤＴＯＫＹＯ」店運営
0,3416,ピクスタ,4,26,100,https://pixta.co.jp/,2005-08-25,2015-09-14,12,パンフレットやHPなどで利用する写真素材をネットで販売するPIXTAを運営。\nインターネット上で写真、イラストなどデジタル素材の仕入れ・販売を展開。アジアに拠点持つ
0,3726,フォーシーズ,1,26,100,http://www.4cs-holdings.co.jp/,2003-12-05,2003-12-05,9,化粧品や健康食品などを通信販売。高価格帯の商品多く、中高年に照準。\nＩＴ発祥。買収で化粧品・健康食品の通販会社に。化粧品やコンタクトレンズ等で相次ぎ買収
0,4350,メディシス,0,26,100,http://www.msnw.co.jp/,1999-09-16,2002-03-18,3,医薬品情報仲介で出発、調剤薬局持ち株会社に。北海道から全国展開。\n薬局向け医薬品情報仲介が祖業の調剤薬局持株会社。Ｍ＆Ａで店舗全国化。介護・医業支援育成
0,4775,総合メディカル,0,26,100,http://www.sogo-medical.co.jp/,1978-06-12,2000-08-10,3,調剤薬局が主力。医療機器リースや医師の転職・開業支援も展開。\n勤務医の転職・開業支援のリース、レンタル土台。調剤薬局は業界上位。シニア向け住宅に進出 [企業特色]
0,5856,東理ホールディングス,1,26,100,http://www.tori-holdings.co.jp/,2004-10-01,2004-10-01,3,ダイカストから出発。酒造や食品小売り、教育関連などに進出。多角化推進。\nダイカスト祖業からＭ＆Ａで酒造、食品ストア、教育等に進出。エス・サイエンスと株式持ち合い
0,6993,ＡＧＣａｐ,1,26,100,http://www.agcap.jp/,1935-12-17,1961-10-01,3,特殊照明機器が主力。防衛省や航空会社向け。事業再生投資にも進出。\n防衛省や航空会社向け特殊照明器が祖業。１３年、大黒屋（チケット大黒屋とは別）を買収して成長
0,7412,アトム,1,26,100,http://www.atom-corp.co.jp/,1972-01-14,1994-11-16,3,回転ずし軸の外食中堅。居酒屋も。名古屋から東日本へ展開。コロワイド傘下。\n居酒屋、ステーキ、回転ずし中心の外食チェーン。名古屋軸に東日本にも展開。コロワイド傘下
0,7415,新星堂,2,26,100,http://www.shinseido.co.jp/,1964-06-01,1994-11-25,2,音楽・映像ソフト販売大手。直営店を全国展開。ワンダーコーポ傘下入りで再建。\nＣＤ、ＤＶＤ小売り大手。１３年２月、大和証券系ファンドからワンダーコーポ傘下に移り再建中
0,7416,はるやま商事,0,26,100,http://www.haruyama.co.jp/,1974-11-06,1994-11-22,3,紳士服専門チェーン。中国地盤から西日本、関東にも進出。新業態を開発へ。\n郊外型紳士服専門チェーンで業界４位。地元中国地方から西日本中心に展開。関東へも店舗進出
0,7419,ノジマ,2,26,100,http://www.nojima.co.jp/,1982-06-23,1994-12-06,3,家電量販店中堅。神奈川地盤から首都圏に展開。デジタル家電などを強化。\n神奈川地盤の家電量販中堅。ＳＣへの出店を積極化。１５年、携帯電話販売のＩＴＸを傘下に
0,7421,カッパ・クリエイト,0,26,100,http://www.kappa-create.co.jp/,1983-08-29,1994-12-16,3,回転すし大手。「かっぱ寿司」を全国展開。低価格路線。コロワイド子会社に。\n１００円均一「かっぱ寿司」が柱。元気寿司と業務提携解消。１４年１２月、コロワイドの子会社に
0,7445,ライトオン,0,26,100,http://www.right-on.co.jp/,1980-04-01,1995-05-26,820,カジュアル衣料チェーン大手。若者向けとファミリー層向けを展開。全国に積極出店。\nジーンズカジュアルチェーン大手。全国の郊外ＳＣ中心に出店。レディス、２０代向け業態育成中
0,7448,ジーンズメイト,0,26,100,http://www.jeansmate.co.jp/,1960-10-14,1995-07-05,220,カジュアル専門チェーン。ジーンズが主力。首都圏中心に路面店展開。経営再建中。\nジーンズ中心のカジュアル専門チェーン。都心部に路面店を展開。業績不振続き経営再建中
0,7450,サンデー,2,26,100,http://www.sunday.co.jp/,1975-05-24,1995-07-12,2,イオン傘下で青森地盤のホームセンター。東北６県に店舗網拡大。子会社に「ジョイ」。\n青森地盤のホームセンター。イオン子会社。東北６県に店舗広げる。小商圏向け小型店舗に注力
0,7452,マツヤ,2,26,100,http://www.s-matsuya.com/,1968-10-01,1995-07-24,2,長野の食品スーパーで県内大手。約30店舗を展開。業務用食材スーパーに力。\n長野の食品スーパー。県内４位クラス。業務用食材スーパーを積極展開。特設注意市場銘柄
0,7453,良品計画,0,26,100,http://ryohin-keikaku.jp/,1989-06-30,1995-08-01,2,自社ブランド「無印良品」で企画から小売りまで。衣料、雑貨等。海外展開。\n西友の事業部が独立。「無印良品」ブランドで衣料、雑貨、食品など卸・小売り。中国ほか海外多数
0,7455,三城ホールディングス,0,26,100,http://www.paris-miki.com/,1950-01-27,1995-08-09,3,眼鏡専門店チェーン大手。「パリミキ」など有名。海外展開も。子会社に金鳳堂。\n眼鏡専門店チェーン大手。子会社に百貨店向け金鳳堂。海外は中国軸に展開。利益は上期偏重
0,7462,ダイヤ通商,2,26,1000,http://www.daiya-tsusho.co.jp/,1949-05-31,1995-09-28,3,首都圏でガソリンスタンド、石油卸を展開。自転車販売も。ビル賃貸が収益源。\n東京・埼玉・川崎でＳＳ展開、石油卸も。自転車専門店「コギー」は湘南中心。ビル賃貸も利益の柱
0,7465,マックスバリュ北海道,2,26,100,http://www.mv-hokkaido.co.jp/,1961-03-17,1995-10-04,2,イオン系食品スーパーで道内大手。小商圏型中心。ダイエーの食品スーパー引き継ぐ。\nイオングループ。北海道３位の食品スーパー。小商圏型ＳＣが軸、ディスカウント店（ＤＳ）も
0,7475,アルビス,0,26,100,http://www.albis.co.jp/,1968-12-23,1995-11-14,3,富山地盤の食品スーパー。石川・福井にも拡大。自社開発の商業施設も展開。\n富山・石川・福井３県で食品スーパー、自社開発の商業施設展開。卸売りからスーパーへ完全移行
0,7494,コナカ,0,26,100,http://www.konaka.co.jp/,1973-11-28,1996-03-26,9,紳士服チェーン大手。関東中心に全国展開。「スーツセレクト」を育成。傘下にフタタ。\n紳士服業界３位。郊外型で関東、東北中心。傘下に九州のフタタ。都市型「スーツセレクト」を育成
0,7506,ハウス　オブ　ローゼ,0,26,100,http://www.houseofrose.co.jp/,1982-04-01,1996-08-08,3,ボディケア品・化粧品の小売り会社。自然志向に特色。フィットネスなども。\n百貨店等でのボディケア品や化粧品の小売りが主。リラクセーションサロンやフィットネスも
0,7508,Ｇ－７ホールディングス,0,26,100,http://www.g-7holdings.co.jp/,1976-06-18,1996-08-22,3,車用品販売と食品スーパー事業が中核。「オートバックス」「業務スーパー」など展開。\n自動車用品店、食品「業務スーパー」をＦＣ展開。農産物直売や不動産開発等も。アジアにも進出
0,7509,アイエーグループ,2,26,1000,http://www.ia-group.co.jp/,1984-03-21,1996-09-03,3,神奈川地盤に「オートバックス」をFC展開、カー用品を販売。ブライダル施設運営も。\n神奈川中心に「オートバックス」ＦＣ展開。ブライダル施設運営、住宅販売など不動産事業も
0,7512,イオン北海道,0,26,100,http://www.aeon-hokkaido.jp/,1978-04-05,1996-09-19,2,イオン系の北海道大手スーパー。旧ポスフール。道内各地に大型総合スーパーを展開。\n北海道の大手スーパー。旧ポスフール。０７年にイオンが子会社化、イオンの北海道事業を承継
0,7513,コジマ,0,26,100,http://www.kojima.net/,1963-08-22,1996-09-12,8,ビックカメラ傘下の家電量販店中堅。関東地盤に全国展開。店舗改革を推進。\n郊外型の家電量販中堅。競争激化で業績悪化し、１２年ビックカメラの傘下に。店舗改革を推進中
0,7514,ヒマラヤ,0,26,100,http://www.himaraya.co.jp/,1991-08-20,1996-09-26,8,スポーツ用品大手。ゴルフ用品主体に一般スポーツ品を扱う。全国に積極出店。\n一般スポーツ、ゴルフ用品等の小売りチェーン。中部地盤に全国展開。１１年に関東のＢ＆Ｄ買収
0,7515,マルヨシセンター,1,26,1000,http://ww2.maruyoshi-center.co.jp/,1970-09-24,1996-09-25,2,四国地盤の食品スーパー中堅。淡路島に進出。PB商品を開発・製造し外販も。\n香川、徳島、愛媛が地盤の中堅食品スーパー。淡路島にも進出。自社工場でＰＢ商品を開発・製造
0,7516,コーナン商事,0,26,100,http://www.hc-kohnan.com/,1978-09-20,1996-09-30,2,大阪地盤のホームセンター大手。近畿圏にドミナント出店。大型店舗展開に注力。\nホームセンター（ＨＣ）大手。大阪・堺市で日曜大工小売店として発足。近畿圏にドミナント出店
0,7520,エコス,0,26,100,http://www.eco-s.co.jp/,1984-09-21,1996-10-24,2,食品スーパー中堅。東京・北関東が地盤。M&Aで規模拡大。傘下に同業社多数。\n東京・多摩地区から北関東へ展開する食品スーパー。Ｍ＆Ａで成長、傘下に複数の同業子会社
0,7522,ワタミ,0,26,100,http://www.watami.co.jp/,1986-05-01,1996-10-31,3,居酒屋チェーン。「和民」等国内外に展開。宅配弁当が収益源。介護事業も柱。\n居酒屋「和民」等を内外で展開。有料老人ホーム、宅配弁当が収益柱。創業者・渡邉氏は取締役辞任
0,7523,アールビバン,2,26,100,http://www.artvivant.co.jp/,1984-11-24,1996-11-01,3,現代版画の催事販売が主体。イラスト系も。リゾートホテル事業やフィットネスも展開。\n催事を定期開催し版画作品を展示販売。イラスト系にも展開。ホテル、フィットネスも手掛ける
0,7524,マルシェ,0,26,100,http://www.marche.co.jp/,1972-05-08,1996-11-19,3,居酒屋を直営とFCで全国展開。「酔虎伝」や「八剣伝」主体に業種多彩。\n居酒屋「酔虎伝」「八剣伝」「居心伝」を核に運営。直営とＦＣで展開。関西、東海地方が地盤
0,7532,ドンキＨＤ,0,26,100,http://www.donki-hd.co.jp/,1980-09-05,1996-12-17,6,総合ディスカウント店を全国展開。深夜営業に特色。子会社にHCドイトや長崎屋。\n深夜まで営業の総合ディスカウント店を首都圏中心に全国展開。子会社にＨＣドイト、長崎屋
0,7544,スリーエフ,1,26,100,http://www.three-f.co.jp/,1981-02-10,1997-07-14,2,コンビニ中堅。神奈川地盤に首都圏へ展開。業態は複数。ローソンと提携。\n神奈川地盤のコンビニ中堅。生鮮コンビニ、店内調理など複数業態持つ。ローソンと業務提携へ
0,7545,西松屋チェーン,0,26,100,http://www.24028.jp/,1956-10-03,1997-07-17,220,ベビー・子供衣料・用品専門店を全国展開。PB商品が中心で低価格戦略。\nベビー・子供衣料と生活雑貨のロードサイド大型店を全国展開。ＰＢ商品中心の低価格戦略
0,7550,ゼンショＨＤ,0,26,100,http://www.zensho.co.jp/,1982-06-30,1997-08-25,3,牛丼大手。「すき家」を直営展開。傘下にファミレスや回転すし店など。\n外食大手。牛丼首位「すき家」が柱。ファミレス「ココス」や「はま寿司」など展開。Ｍ＆Ａに積極的
0,7554,幸楽苑ホールディングス,0,26,100,http://www.kourakuen.co.jp/,1970-11-11,1997-09-02,3,ラーメンチェーン大手。福島本拠に「幸楽苑」展開。低価格武器だが価値重視品も。\n福島を本拠にラーメンチェーン「幸楽苑」を展開。低価格路線。郊外型とフードコート内店多い
0,7561,ハークスレイ,0,26,100,http://www.hurxley.co.jp/,1980-03-18,1997-09-17,3,持ち帰り弁当大手。「ほっかほっか亭」西日本担当。弁当宅配を強化。\n弁当「ほっかほっか亭」の西日本地区ＦＣ統括会社。弁当宅配強化中。直営で「びっくり寿司」も
0,7562,安楽亭,1,26,1000,http://www.anrakutei.co.jp/,1978-11-17,1997-09-25,3,関東中心に焼肉店をチェーン展開。甲信越にも進出。多角化部門は売却。\n埼玉県発祥で、「安楽亭」が主力の郊外路面型焼き肉チェーン。関東、甲信越で展開。派生業態も
0,7564,ワークマン,2,26,100,http://www.workman.co.jp/,1982-08-19,1997-09-26,3,作業服・関連用品の専門チェーン最大手。低価格に特色。全国展開目指す。\n作業服、関連用品の専門チェーン。直営店のＦＣ化推進。ＰＢ比率向上、全国展開目指す
0,7571,ヤマノホールディングス,2,26,100,http://www.yamano-hd.com/,1987-02-20,1997-11-11,3,和洋装品や宝飾品の販売が主力。スポーツ用品専門店も展開。通販に積極的。\nスポーツ用品専門店、展示会販売、和装、美容室を展開。Ｗｅｂ活用の集客や通販にも積極的
0,7577,パスポート,2,26,100,http://www.passport.co.jp/,1969-07-01,1997-12-10,2,インテリア・生活雑貨の小売り。首都圏を地盤に直営・FCで全国展開。\nインテリア雑貨・生活雑貨専門店、駅ビルなどへの直営出店とＦＣ併営。首都圏中核に全国展開
0,7578,ニチリョク,2,26,1000,http://www.nichiryoku.co.jp/,1966-12-22,1998-02-20,3,霊園や納骨堂の受託開発・販売大手。葬祭事業に重点シフト、終活セミナーなども。\n霊園や堂内陵墓（納骨堂）受託開発・販売の業界大手。家族葬、直葬など葬儀事業に重点シフト
0,7581,サイゼリヤ,0,26,100,http://www.saizeriya.co.jp/,1973-05-01,1998-04-23,8,イタリアンレストラン「サイゼリヤ」を直営展開。低価格メニューに特色。中国展開に注力。\n低価格のイタリアファミレス「サイゼリヤ」を直営展開。自社豪工場で食材生産。中国展開に力
0,7585,かんなん丸,2,26,100,http://www.kannanmaru.co.jp/,1982-05-04,1998-06-09,6,大庄のFCで埼玉担当。居酒屋「庄や」などをFC展開。「ドトール」なども。\n居酒屋、大庄のＦＣ。埼玉県が担当エリア。「庄や」「日本海庄や」を展開。ドトールのＦＣも
0,7593,ＶＴホールディングス,0,26,100,http://www.vt-holdings.co.jp/,1983-03-22,1998-09-10,3,ホンダ・日産系ディーラー。中古車輸出やレンタカーも。M&A積極展開、多角化推進。\n日産、ホンダを扱う自動車ディーラー。中古車輸出やレンタカー、住宅販売も。Ｍ＆Ａに積極的
0,7596,魚力,0,26,100,http://www.uoriki.co.jp/,1984-12-01,1998-11-20,3,鮮魚小売り大手。首都圏中心に専門店を百貨店や駅ビル内に展開。\n鮮魚専門店を百貨店、駅ビル内に展開。居酒屋、すしの飲食店を併営。国内、米国で卸事業も
0,7601,ポプラ,0,26,100,http://www.poplar-cvs.co.jp/,1976-04-20,1999-02-05,2,中国地方地盤のコンビニ。売り上げ歩合ロイヤルティー制度に特色。ローソンと提携。\n自社食品供給と売上歩合ロイヤルティ制に特徴。独立路線を転換し１４年にローソンと資本提携
0,7603,マックハウス,2,26,100,http://www.mac-house.co.jp/,1990-06-01,1999-02-10,2,ジーンズカジュアル衣料チェーン。ファミリー向け中心に全国展開。靴のチヨダ子会社。\nジーンズカジュアル衣料チェーン。全国のロードサイドやＳＣ内に出店。靴のチヨダの子会社
0,7604,梅の花,1,26,100,http://www.umenohana.co.jp/,1990-07-01,1999-04-21,9,和食店大手。湯葉と豆腐の高級店「梅の花」中心。持ち帰りすしなども。\n高級和食店「梅の花」が主力。デパ地下向け持ち帰りずし「古市庵」も。Ｈ２Ｏリテイリングと提携
0,7605,フジ・コーポレーション,2,26,100,http://www.fujicorporation.com/,1982-11-04,1999-06-22,10,自動車用タイヤ・ホイール専門店を展開。東北・関東を中心に直営店、通販も。\nタイヤの専売店「タイヤ＆ホイール館フジ」を東北、関東中心に直営展開。通販も手掛ける
0,7606,ユナイテッドアローズ,0,26,100,http://www.united-arrows.co.jp/,1989-10-02,1999-07-30,3,セレクトショップ大手。紳士・婦人服や雑貨を販売。「ユナイテッドアローズ」が主力。\n紳士・婦人衣料や雑貨セレクトショップを展開。価格帯別の業態展開。百貨店からＳＣまで対応
0,7610,テイツー,2,26,100,http://www.tay2.co.jp/,1990-04-16,1999-09-14,2,西日本地盤の古本店チェーン。「古本市場」主力にネット通販も。関東を強化。\n中古本・ソフト販売の「古本市場」軸にネット通販（ＥＣ）にも展開。西日本地盤、関東強化進める
0,7611,ハイデイ日高,0,26,100,http://www.hiday.co.jp/,1983-10-22,1999-09-16,2,ラーメン店を首都圏中心にチェーン展開。低価格「中華食堂日高屋」が主力。\n中華料理とつまみの「中華食堂日高屋」主力。首都圏の駅前・繁華街立地で展開。直営出店主義
0,7614,オーエムツー,2,26,100,http://www.om2.co.jp/,1989-07-19,1999-10-01,1,中国地方地盤の食肉小売りチェーン。関東・関西に展開。傘下に総菜、焼き肉。\n中国地方発祥の食肉小売業。外食事業へ展開。関東、関西開拓。エスフーズ傘下、Ｍ＆Ａに意欲
0,7615,京都きもの友禅,0,26,100,http://www.kyotokimonoyuzen.co.jp/,1971-08-05,1999-10-01,3,着物の小売りチェーンを展開。低価格路線で振り袖に注力。会員組織に特色。\n振袖を軸に着物を直営店で小売り。現金仕入れで低価格実現。既存顧客の「友の会」も強み
0,7616,コロワイド,0,26,100,http://www.colowide.co.jp/,1963-04-19,1999-10-13,3,外食大手。居酒屋「甘太郎」中心に直営展開。傘下にレインズやカッパクリエなど。\n居酒屋「甘太郎」等を展開。アトムや「牛角」をレインズ買収。１４年１２月にカッパＨＤを子会社化
0,7618,ＰＣデポ,2,26,100,http://www.pcdepot.co.jp/,1994-08-11,1999-10-29,3,関東地盤のパソコン専門店。修理サービスが収益柱。プロバイダ事業なども。\n神奈川地盤のパソコン量販。プロバイダ事業等も展開。月々の収入見込める会員サービス拡大中
0,7621,うかい,2,26,100,http://www.ukai.co.jp/,1968-03-25,1999-11-12,3,和洋食の高級レストランを直営。「うかい烏山」など首都圏に展開。美術館も。\n「うかい鳥山」など和洋食の高級レストラン直営。近年は東京都心に注力。箱根で美術館事業も
0,7623,サンオータス,2,26,100,http://www.sunautas.co.jp/,1951-05-14,1999-12-10,4,神奈川地盤にガソリンスタンドを経営。輸入車販売も。生活関連事業を強化。\n神奈川県下でＥＮＥＯＳやキグナスのＳＳ展開。ＢＭＷ等輸入車販売。レンタカー店積極開発
0,7625,グローバルダイニング,1,26,100,http://www.global-dining.com/,1973-10-05,1999-12-07,12,首都圏地盤の外食チェーン。イタリア、アジア料理などのレストランを展開。米に出店。\n都内軸に「ラ・ボエム」など和洋食のダイニングレストランを展開。米国にも出店。オーナー色
0,7630,壱番屋,0,26,100,http://www.ichibanya.co.jp/,1982-07-01,2000-02-10,5,カレー専門店を直営・FCで全国展開。海外出店を加速。パスタなど新業態も。\nカレー専門店を直営・ＦＣ展開。本拠地の中部から首都圏、関西へ拡大。パスタ、ラーメン店も
0,7636,ハンズマン,2,26,100,http://www.handsman.co.jp/,1964-12-23,2000-03-01,6,宮崎地盤のホームセンター中堅。大型店に特色。県外に積極出店、九州全域に。\n宮崎地盤の中堅ホームセンター。大型店運営に特徴。県外出店進め九州での地域チェーン目指す
0,7638,シーマ,2,26,100,http://www.cima-ir.jp/,1994-09-05,2000-03-15,3,ブライダルダイヤが主力。セミオーダーに特色。主要都市に店舗展開。海外に子会社。\nブライダルダイヤ主力で裸石とリングのオーダーメードに特徴。イスラエルに仕入れ子会社
0,7640,トップカルチャー,0,26,100,http://www.topculture.co.jp/,1986-12-12,2000-04-13,10,書籍・ソフトなどの複合店「蔦屋書店」を展開。販売とレンタル。関東を強化。\n書籍、ＣＤ、ＤＶＤ等の複合店「蔦屋書店」を展開。レンタルは大株主ＣＣＣの加盟店、関東強化
0,7643,ダイイチ,2,26,100,http://www.daiichi-d.co.jp/,1958-07-11,2000-04-25,9,北海道の食品スーパー。帯広から旭川、札幌に展開。ヨーカ堂と提携。\n北海道の食品スーパー。帯広地盤で旭川、札幌にも展開。１３年夏にヨーカ堂と資本・業務提携
0,7646,ＰＬＡＮＴ,0,26,100,http://www.plant-co.jp/,1982-01-21,2000-06-02,920,北陸地盤に大型ディスカウントストアを展開。郊外で衣食住を格安で販売。\n北陸地盤で近畿等にも展開。郊外で衣食住を格安販売する超大型スーパーセンターの先駆
0,7647,音通,1,26,1000,http://www.ontsu.co.jp/,1981-08-10,2000-05-31,3,100円ショップ「フレッツ」が主力。カラオケ機器レンタル・卸も展開。スポーツ施設も運営。\n１００円均一店「フレッツ」運営が主。関西が地盤。カラオケ機器レンタル、スポーツ施設運営も
0,7649,スギホールディングス,0,26,100,http://www.drug-sugi.co.jp/hd/,1982-03-08,2000-06-19,2,ドラッグストア「スギ薬局」をチェーン展開。調剤薬局併設店に強み。中部地盤。\n東海地盤。調剤併設のドラッグストア「スギ薬局」展開。ディスカウント業態（ＤＳ）も手掛ける
0,7918,ヴィアＨＤ,2,26,100,http://www.via-hd.co.jp/,1948-02-26,1963-06-28,3,外食チェーン。首都圏地盤に焼き鳥居酒屋などを展開。雑誌印刷からは撤退。\n印刷から撤退、外食に集中。焼き鳥居酒屋、お好み焼き屋など傘下。首都圏地盤。Ｍ＆Ａ積極的
0,8005,スクロール,0,26,100,http://www.scroll.jp/,1943-10-01,1971-10-01,3,カタログ通販準大手。女性向けアパレルや生活雑貨が主力。生協向けが過半。\n旧ムトウ。カタログ通販準大手でネット販売も積極展開。女性向け衣料中心。生協向けが約６割
0,8008,４℃ホールデ,0,26,100,http://www.yondoshi.co.jp/,1950-05-18,1972-12-01,2,ジュエリーブランド「4℃」を展開。アパレル卸も。カジュアル衣料や革小物など扱う。\n宝飾「４℃」のエフ・ディ・シィ・プロダクツが中核。革小物、カジュアル・実用衣料なども積極展開
0,8028,ファミリーマート,0,26,100,http://www.family.co.jp/,1981-09-01,1987-12-07,2,伊藤忠系コンビニ大手。首都圏に強み、全国展開。アジアなど海外も積極化。\n伊藤忠系のコンビニで業界３位。ａｍ／ｐｍ買収で首都圏強化。アジアはじめ海外も積極展開
0,8160,木曽路,0,26,100,http://www.kisoji.co.jp/,1952-09-30,1987-11-04,3,外食中堅。しゃぶしゃぶ「木曽路」は業界最大手。居酒屋なども経営。\nしゃぶしゃぶの最大手。居酒屋「素材屋」なども経営。中部地盤から首都圏、関西圏にも進出
0,8163,サトＲＳ,0,26,100,http://www.sato-restaurant-systems.co.jp/,1968-08-27,1984-03-15,3,関西地盤の外食中堅。ファミレスの「和食さと」を主力に「すし半」なども展開。\n関西圏地盤の外食中堅。郊外型ファミレス「和食さと」が主力。すし業態「すし半」も展開
