0,7575,日本ライフライン,2,25,100,http://www.jll.co.jp/,1981-02-06,1997-12-08,3,医療機器輸入商社。心臓領域に強み。電極カテーテルなど自社生産にも注力。\n医療機器輸入商社。ペースメーカーなど心臓領域が得意分野、電極カテーテル等を自社生産
0,7587,ＰＡＬＴＥＫ,2,25,100,http://www.paltek.co.jp/,1982-10-14,1998-07-16,12,独立系半導体商社。特定用途向けに強み。設計支援や自社製品開発も。\n独立系半導体商社。中心はＦＰＧＡ中核の外国製半導体販売。設計受託、生産、自社製品開発推進
0,7590,タカショー,2,25,100,http://www.takasho.co.jp/,1980-08-21,1998-09-01,120,ガーデニング商品大手。プロ商材など取扱品国内首位級。海外事業を強化。\nガーデニング品取り扱い国内トップ級。中国、欧州、北米など海外事業強化。利益は上期に集中
0,7591,エクセル,0,25,100,http://www.excelweb.co.jp/,1961-07-25,1998-09-17,3,独立系エレクトロニクス商社。液晶デバイス、電子部品が主力。シャープ製品が中心。\n独立系エレクトロニクス商社。液晶デバイス、半導体、電子部品などシャープ製品が主力
0,7594,マルカキカイ,0,25,100,http://www.maruka.co.jp/,1946-12-16,1998-09-30,11,産業機械・建設機械の専門商社。米・中・東南アジアに拠点。メキシコを強化。\n産機・建機併営の中堅商社。産機は自動車向け中心。日・米・中・東南アジアの４極体制で展開
0,7597,東京貴宝,2,25,1000,http://www.tokyokiho.com/,1960-11-07,1998-12-01,3,宝飾品卸の専業大手。催事販売で成長。自社製中高級ジュエリーなどに強み。\n宝飾品卸専業大手。取引先の得意客対象の催事販売で成長。フルアイテム持つが中高級品に強み
0,7599,ガリバー,0,25,100,http://221616.com,1994-10-25,1998-12-11,2,中古車買い取り最大手。中古車小売りに注力、新車販売も。直営店強化。\n中古車買い取り最大手。直営、ＦＣで全国展開。中古車小売りを強化。新車販売も手掛ける
0,7600,日本エム・ディ・エム,0,25,100,http://www.jmdm.co.jp/,1973-05-28,1998-12-15,3,医療器具の輸入販社。骨接合材料や人工関節などを輸入。自社製品拡大。\n骨接合材料や人工関節など整形外科器具の輸入販社。米国子会社での製造通じ自社製品拡大
0,7602,カーチスＨＤ,1,25,100,http://www.carchs-hd.com/,1987-12-10,1999-02-10,3,中古車の買い取り大手。大型展示場で小売りに注力。車検・修理サービスも。\n中古車買い取り大手。大型展示場で小売りも注力。大株主に翻弄された過去から経営再建進む
0,7607,進和,0,25,100,http://www.shinwa-jpn.co.jp/,1951-02-12,1999-08-06,8,エンジニアリングの商社兼メーカー。溶接機や接合材料など。自動車向けが中心。\n溶接装置や接合材料を扱う商社兼メーカー。自社製品比率上昇中。７割が自動車向け。好財務
0,7608,エスケイジャパン,0,25,100,http://www.sk-japan.co.jp/,1989-12-14,1999-08-24,2,ゲームセンター向け景品やキャラクター関連商品が主力。ムック本や雑誌付録なども。\nゲームセンター景品の企画販売が主力。キャラクター販促品も扱う。ムック本や雑誌付録も展開
0,7609,ダイトエレクトロン,0,25,100,http://www.daitron.co.jp/,1952-06-24,1999-09-08,12,電子部品卸中堅。製造装置にも強み。スイッチ電源など自社製造製品に注力。\n電子部品中堅卸。製販一体推進。半導体など製造装置も。米国に工場。スイッチ電源を自社製造
0,7612,ＣＷＥ,2,25,1000,http://www.cwe.co.jp/,1977-08-25,1999-09-21,3,コンテンツの企画・制作。パチンコ・パチスロ関連が主力。アミューズメント・キャラクター事業も。\nパチンコ・パチスロ向けコンテンツ仲介。アミューズメント、キャラクター事業も。事業再編中
0,7613,シークス,0,25,100,http://www.siix.co.jp/,1992-07-01,1999-09-22,12,電子・機械部品商社。製造受託サービスを拡大。調達から物流まで一貫。\n電子部品の商社が起源。基板実装中心に製造受託も展開。調達から物流まで一貫体制に強み
0,7619,田中商事,0,25,100,http://www.tanakashoji.co.jp/,1962-12-07,1999-11-11,3,独立系電設資材総合卸。電線、配・分電盤が主力。LED照明等環境関連も。\n電気設備業者向け電設資材等の卸中堅。独立系。東海、東京以北が営業基盤だが九州等にも拠点
0,7624,ＮａＩＴＯ,2,25,100,http://www.naito.net/,1953-01-23,1999-12-14,2,機械工具卸老舗。切削工具中心に特約店に販売。自動車業界向けが柱。\n切削・機械工具、産業機器の老舗卸。特約店通じて販売。自動車業界向けが主力。岡谷鋼機傘下
0,7628,オーハシテクニカ,0,25,100,http://www.ohashi.co.jp/,1953-03-12,2000-01-26,3,独立系の自動車部品メーカー。企画開発と販売が主体。携帯電話用部品も。\n自動車部品を手掛ける独立系メーカー。携帯電話用部品も。国内子会社をマザー工場として開発
0,7634,星医療酸器,2,25,100,http://www.hosi.co.jp/,1974-04-15,2000-02-18,3,医療用ガス最大手。病院向けと在宅用の２本柱。関東中心に全国展開へ。\n医療用ガスで首位。関東でシェア３割強。全国展開志向。在宅酸素事業が第２の柱に成長
0,7635,杉田エース,2,25,100,http://www.sugita-ace.co.jp/,1948-09-11,2000-02-18,3,建材商社。ビル・住宅建築用金物やDIY商品が中心。増改築用を開拓。\n建築用金物を柱とする建材商社。開発は自社で行い生産は外部委託。増改築用を掘り起こす
0,7637,白銅,0,25,100,http://www.hakudo.co.jp/,1949-11-01,2000-03-09,3,非鉄金属商社。加工、小口、短納期が強み。顧客の要望に柔軟に対応。\n金属商社。加工、小口、短納期が強み。主納入先は半導体・液晶製造装置。配当性向４０％厳守
0,7648,トーカン,9,25,0,http://www.tokan-g.co.jp/,1949-10-18,2000-06-08,9,中部地盤の食品卸中堅。ユニーグループとの取引が過半。豊田通商と提携。\n東海４県地盤の食品卸大手。サークルＫサンクス等ユニー系５社取引が５割超。豊田通商と提携
0,7903,名古屋木材,9,25,0,http://www.meimoku.co.jp/,1945-12-28,1949-05-01,3,木質建材中堅。木材店ルート中心に直販にも注力。不動産事業なども。\n木質系の建築資材を主に地元木材店ルートで取り扱う。直販も。不動産は分譲、賃貸など手広い
0,8001,伊藤忠商事,0,25,100,http://www.itochu.co.jp/ja/,1949-12-01,1950-07-01,3,総合商社大手。非資源事業が主力。中国ビジネスに強み。傘下にファミマなど。\n総合商社大手。非財閥系の雄。繊維や中国ビジネス強い。傘下にファミリーマート等の有力企業
0,8002,丸紅,0,25,100,http://www.marubeni.co.jp/,1949-12-01,1950-07-01,3,芙蓉グループの総合商社。穀物メジャーの一角。紙パや電力、プラントにも強み。\n芙蓉グループの総合商社５位。穀物取扱高で首位。プラントや紙パルプ、海外発電事業も強い
0,8006,ユアサ・フナショク,1,25,1000,http://www.yuasa-funashoku.com/,1937-01-18,1972-09-20,3,関東地盤の食品卸中堅。地域スーパー向け中心。ビジネスホテルや不動産賃貸も。\n千葉中心に関東地盤の食品卸。地域スーパーが主販売先。ビジネスホテル「パールホテル」も運営
0,8007,高島,0,25,1000,http://www.tak.co.jp/,1931-12-01,1949-05-01,3,重布で創業、建材や物流資材・電子部品などにシフト。太陽光発電機器も柱。\n重布から出発。建材、物流資材、電子部品等へ多角化。太陽光発電機器の先発組で主力事業に
0,8012,長瀬産業,0,25,100,http://www.nagase.co.jp/,1917-12-09,1964-09-01,3,化学専門商社最大手。染料や合成樹脂に強み。医薬品原料なども注力。\n染料・合成樹脂等の化学品専門商社首位。医薬中間体等も展開。倒産したバイオの林原を買収
0,8014,蝶理,0,25,100,http://www.chori.co.jp/,1948-09-02,1959-09-01,3,繊維商社の老舗。東レ子会社。化学品事業強化、中国ビジネス拡大へ。\n繊維商社の老舗、東レ子会社。化学品事業を加え事業拡大。中国では化学品や機械など事業展開
0,8015,豊田通商,0,25,100,http://www.toyota-tsusho.com/,1948-07-01,1961-10-01,3,トヨタ系総合商社。金属・自動車に強み。機械・エネルギーや化学品なども成長。\nトヨタグループの商社、０６年トーメン合併。原料調達や物流などでトヨタ支援。非自動車強化中
0,8018,三共生興,0,25,100,http://www.sankyoseiko.co.jp/,1938-12-11,1961-10-01,3,繊維商社の老舗。高級服ブランドを展開。欧米ブランド「DAKS」のライセンス保有。\n繊維商社の老舗。高級カジュアル衣料も。「ＤＡＫＳ」など欧米高級ブランドライセンスを保有
0,8020,兼松,0,25,1000,http://www.kanematsu.co.jp/,1918-03-18,1961-10-01,3,総合商社から専門商社にシフト。電子、食糧、鉄鋼が柱に。資金効率改善へ。\n老舗商社。電子・ＩＴ、食料、鉄鋼・プラント事業の３本柱。資源権益への投資はせず、堅実経営
0,8023,大興電子通信,1,25,1000,http://www.daikodenshi.jp/,1953-12-01,1986-11-11,3,富士通特約店。情報通信機器販売とシステム開発が両輪。\n富士通特約店で売上３位。通信機器、情報システムが双柱。中堅企業向けクラウドビジネス注力
0,8025,ツカモト,0,25,1000,http://www.tsukamoto.co.jp/,1920-01-05,1963-10-01,3,和洋装の商社。ホームファニシングなどが成長。都内の保有不動産賃貸が高収益。\n和洋装の総合繊維商社。０８年４月和装の市田を子会社化。都内に高収益不動産保有、健康器具も
0,8030,中央魚類,1,25,1000,http://www.marunaka-net.co.jp/,1947-07-03,1964-09-01,3,水産荷受け大手。築地の取扱金額首位。日水と親密。不動産賃貸事業も。\n水産荷受け大手。市場内取引多く、築地の取扱金額トップクラス。日本水産などが大手荷主
0,8031,三井物産,0,25,100,http://www.mitsui.com/jp/ja/,1947-07-25,1949-05-01,3,総合商社の名門。鉄鉱石、原油の生産権益量で断トツ。海外も収益源。\n三菱商事と並ぶ総合商社の雄。鉄鉱石、原油の生産権益量は商社断トツ。インフラ等にも強み
0,8032,日本紙パルプ商事,0,25,1000,http://www.kamipa.co.jp/,1916-12-15,1964-03-18,3,紙流通最大手。洋紙全般に強み。米や中国など海外拡大。不動産賃貸も。\n紙流通首位。製紙２強の製品取扱高多く強みに。米国軸に海外が拡大。貸しビルや古紙回収兼営
0,8036,日立ハイテクノロジーズ,0,25,100,http://www.hitachi-hightech.com/jp/,1947-04-12,1971-10-01,3,日立系。自社開発の半導体製造装置が主力。医用分析装置なども育成。\n商社から出発、日立の計測器・半導体装置部門統合。医用分析装置など半導体分野以外を育成中
0,8037,カメイ,0,25,100,http://www.kamei.co.jp/,1932-12-29,1986-10-30,3,東北地方トップの石油販社。酒類や食料、自動車関連など多角化。\n東北最大の石油・ＬＰガス卸。傘下にトヨタ販社。Ｍ＆Ａ駆使した多角化で総合商社を志向
0,8038,東都水産,0,25,1000,http://www.tohsui.co.jp/,1948-03-09,1956-09-01,3,独立系の水産荷受け大手。冷蔵倉庫、貸しビル事業等に多角展開。\n水産荷受け大手。冷蔵倉庫、不動産賃貸事業も併営。独立系。カナダで加工品製造も行う
0,8039,築地魚市場,1,25,1000,http://www.tsukiji-uoichiba.co.jp/,1948-03-09,1963-09-01,3,独立系の水産荷受け大手。加工品販売も。冷蔵倉庫や不動産賃貸も展開。\n水産荷受け大手。独立系。加工品販売や不動産賃貸業も展開。非連結で上海にも子会社あり
0,8041,ＯＵＧホールディングス,0,25,1000,http://www.oug.co.jp/,1946-06-12,1961-10-01,3,大阪市場の水産物卸大手。養殖も。市場外取引を拡大。子会社にショクリュー。\n大阪市中央卸売市場の水産物卸売り。国内最大規模。市場外取引を拡大中。養殖も手掛ける
0,8043,スターゼン,0,25,100,http://www.starzen.co.jp/,1948-06-17,1962-11-01,3,食肉卸最大手。食肉処理も手掛ける。海外に積極進出。子会社にローマイヤ。\n食肉卸首位で全国に販売網。外食向け加工肉も扱う。子会社にハム・ソーセージのローマイヤ
0,8044,大都魚類,1,25,1000,http://www.daitogyorui.co.jp/,1947-10-01,1962-12-01,3,マルハニチロ系の水産荷受け大手。首都圏に複数拠点。オフィスビルなど不動産も。\n水産荷受け大手。マルハニチロ傘下。足立、大田区など首都圏に複数拠点。海外生産者とも連携
0,8045,横浜丸魚,2,25,1000,http://www.yokohama-maruuo.co.jp/,1947-10-30,1963-06-12,3,神奈川の水産荷受け。横浜中央卸売市場を地盤に市場外取引も積極化。\n神奈川の水産荷受け。横浜のほか、川崎に拠点。市場外取引も積極的。マルハニチロなど荷主
0,8046,丸藤シートパイル,1,25,1000,http://www.mrfj.co.jp/,1947-09-12,1963-04-18,3,建設仮設材の販売・リース大手。東日本地盤。鉄骨加工や工事を強化。\n建設仮設材の販売、賃貸で２位グループ。三井物産系。東日本が地盤。工事、鉄骨加工を拡充
0,8051,山善,0,25,100,http://www.yamazen.co.jp/,1947-05-30,1962-10-01,3,機械・工具専門商社の大手。工作機械や住設機器などに強み。海外強化。\n機械・工具、住宅設備・家庭用機器の専門商社で大手。展示即売会を全国展開。海外事業を強化中
0,8052,椿本興業,0,25,1000,http://www.tsubaki.co.jp/,1938-01-10,1962-10-01,3,機械商社中堅。チェーン、コンベヤなど動伝商品が主力。FA関連を拡充へ。\n機械の中堅商社。モーター、チェーンなど動伝商品が柱。液晶関連の搬送装置などＦＡ関連拡充
0,8053,住友商事,0,25,100,http://www.sumitomocorp.co.jp/,1919-12-24,1949-08-03,3,住友系の総合商社。金属取引等に強み。CATVなどメディア事業も展開。\n住友系の総合商社。鋼管・鋼材強い。ＣＡＴＶなどメディアも強み。資源は銀・亜鉛など非鉄が軸
0,8057,内田洋行,0,25,1000,http://www.uchida.co.jp/,1941-05-29,1964-01-01,720,オフィス家具大手。学校備品・システムにも強み。業務統合ソフトなど情報関連も。\nオフィス家具大手。学校備品・システムに強い。ＥＲＰ（業務統合ソフト）やライセンス販売も
0,8058,三菱商事,0,25,100,http://www.mitsubishicorp.com/,1950-04-01,1954-06-01,3,三菱グループの中核で総合商社最大手。エネルギー関連に強み。化学品や食品も。\n総合商社首位。三菱グループ中核。原料炭等の資源筆頭に機械、化学品、食品等の事業基盤厚い
0,8059,第一実業,0,25,1000,http://www.djk.co.jp/,1948-08-12,1962-08-01,3,機械商社。石油掘削装置や成形機、実装機など多彩。有力子会社擁す。\n機械商社。石油掘削・精製装置から成形機、実装機まで広範囲。機械メンテ等有力子会社擁す
0,8060,キヤノンＭＪ,0,25,100,http://canon.jp/,1968-02-01,1981-08-24,12,OA機器販社。キヤノンの国内販売が主力。営業力に定評。ITソリューションに注力。\n複合機、カメラ、インクジェットプリンタ等、キヤノン製品の国内販売が主。ＩＴ事業も育成
0,8061,西華産業,0,25,1000,http://www.seika.com/,1947-10-01,1961-09-01,3,三菱系機械商社。発電プラント関連が主力で、三菱重工向けが過半。\n三菱系機械商社。三菱重工と親密で発電プラント関連が主力商材。子会社で産業用バルブ事業
0,8065,佐藤商事,0,25,100,http://www.satoshoji.co.jp/,1949-02-05,1962-05-01,3,金属専門商社。自動車向け鋼材が主力。非鉄・電子材料や貴金属製品も。\n金属専門商社。トラック、建機向け多い。非鉄・電子材料に展開。金属洋食器等の直営店舗も
0,8066,三谷商事,1,25,100,http://www.mitani-corp.co.jp/,1946-03-20,1963-12-01,3,建材主力の商社。生コン販売量で首位。石油やIT関連も柱。風力発電に力。\n生コン販売量首位。石油やＩＴ関連も全国的。風力発電に傾倒、福井で自動車販売やＣＡＴＶ
0,8068,菱洋エレクトロ,0,25,100,http://www.ryoyo.co.jp/,1961-02-27,1986-12-11,1,独立系の半導体商社。米インテルなど外国製に強み。情報ソリューションも展開。\n独立系半導体商社。インテル等外国製や三菱電機製などを扱う。情報ソリューション事業も展開
0,8070,東京産業,0,25,100,http://www.tscom.co.jp/,1942-04-16,1961-10-01,3,三菱系の機械専門商社。三菱重工製品の代行取扱が主力。工作機械に力。\n東日本の電力会社向け三菱重工製品が主力の機械商社。化学、工作機械でマージン拡大目指す
0,8071,東海エレクトロニクス,9,25,0,http://www.tokai-ele.co.jp/,1955-05-24,1986-12-17,3,三菱電機系の電子材料、機器専門商社。自動車向け拡大。海外積極展開。\n電子材料、機器の専門商社。取扱商品は三菱電機系多い。自動車向け増加。海外展開を積極化
0,8072,日本出版貿易,2,25,1000,http://www.jptco.co.jp/,1942-02-16,1997-11-28,3,出版物の輸出入が主体。図書館向け主力。輸入音楽CDも。海外に直営店。\n書籍、雑誌の輸出入主体。輸入音楽ＣＤも展開、海外に書籍・雑貨直営店。トーハンが筆頭株主
0,8074,ユアサ商事,0,25,100,http://www.yuasa.co.jp/,1919-06-25,1961-10-01,3,機械、工具が主力の商社老舗。工作機械は取扱高首位。住宅関連に注力。\n１６６６年創業の老舗商社。工作機械は取扱高最大手。産業機器や空調、建材など展開領域広い
0,8075,神鋼商事,0,25,1000,http://www.shinsho.co.jp/,1946-11-12,1961-10-01,3,神鋼系商社。鉄鋼・非鉄金属などグループの取り扱い大半。IT関連機器も。\n神戸製鋼系の専門商社。グループ内の製品や鉄鋼原料の取り扱いが大半。情報分野を重点育成
0,8076,カノークス,9,25,0,http://www.canox.co.jp/,1948-01-29,1961-10-01,3,中部地盤の鉄鋼商社中堅。トヨタなど自動車向け主力。産業機械向けも。\nトヨタ自動車向けが主力の鉄鋼商社。自動車向け５割以上。建材など非自動車向け育成中
0,8077,小林産業,0,25,100,http://www.kobayashi-metals.co.jp/,1941-06-18,1961-10-01,10,ねじ専門商社。建設用ボルト・ナットで首位。全国に販売網。グループに工具卸。\n建設用ボルト・ナットの首位商社。機械向けなどを充実。工具卸もグループに加え、業容拡大
0,8078,阪和興業,0,25,1000,http://www.hanwa.co.jp/,1947-04-01,1963-08-01,3,独立系の鉄鋼商社。石油、木材、水産品など多角化。中国にも強み。\n独立系の鉄鋼商社。鋼材市場で存在感大。非鉄や水産物輸入など総合化推進。中国にも強い
0,8079,正栄食品工業,1,25,100,http://www.shoeifoods.co.jp/,1947-11-04,1986-08-28,10,食品専門商社。乳製品・油脂類が主。製パン製菓用材料も。米中に加工工場。\n製パン・製菓用材料等の食品商社。世界各地から原材料、製品輸入。国内、米国、中国に加工工場
0,8081,カナデン,0,25,100,http://www.kanaden.co.jp/,1912-12-18,1963-05-01,3,三菱電機系商社。重電・電子機器からFA・ビル設備・OA機器などに展開。\n１９０７年電力会社から分離。三菱電機系商社。ＦＡ、ビル設備、インフラ、デバイスを手掛ける
0,8084,菱電商事,0,25,1000,http://www.ryoden.co.jp/,1947-04-22,1963-04-01,3,三菱電機系商社で最大。半導体、冷熱住機、ビル昇降機など幅広く展開。\n三菱電機系商社で最大。ＦＡ、ビル昇降機・空調から半導体まで幅広い。三菱電機へ装置納入も
0,8085,ナラサキ産業,1,25,1000,http://www.narasaki.co.jp/,1943-10-05,1963-04-01,3,北海道地盤の商社。三菱電機代理店業務が主体。産機、燃料、建材など。\n北海道が地盤。三菱電機代理店業務が柱。農業設備、燃料、建設資材、港湾作業、建機に多角化
0,8087,フルサト工業,0,25,100,http://www.furusato.co.jp/,1959-05-19,1986-10-24,3,鉄骨建築用副資材の大手。直販体制に強み。子会社で機械工具も。\n鉄骨建築用副資材の大手。自社製品に強み。傘下の機械商社が成長、自動車生産向け工具へ展開
0,8088,岩谷産業,0,25,1000,http://www.iwatani.co.jp/jpn/,1945-02-02,1962-08-01,3,産業用・家庭用ガス商社。LPGで首位。合成樹脂等も。液化水素で市場開拓。\n産業・家庭用ガス専門商社。ＬＰガス首位。合成樹脂、金属等も。ガス需要期の下期に利益偏重
0,8089,すてきナイスグループ,0,25,1000,http://www.suteki-nice.jp/,1950-06-23,1962-07-01,3,住宅関連商社。住宅資材販売と不動産が両輪。木材市場業界で最大手。\n資材とマンション・戸建ての２本柱。木材市場業界では最大手。資材販売先への受注支援が強み
0,8090,昭光通商,0,25,1000,http://www.shoko.co.jp/,1947-05-28,1962-06-01,12,昭和電工グループの中核商社。化学品を主力に合成樹脂、金属も柱。\n昭和電工グループの中核商社。化学品、合成樹脂、金属、電子材料、半導体製造機器など展開
0,8091,ニチモウ,0,25,1000,http://www.nichimo.co.jp/,1919-08-17,1962-05-01,3,漁網、漁具、水産物商社。海洋事業と水産加工品が柱。バイオ事業を育成へ。\n水産品と漁網・漁具などの海洋事業が２本柱、食品加工機械や資材も扱う。バイオ事業育成中
0,8093,極東貿易,0,25,1000,http://www.kbk.co.jp/,1947-11-27,1987-03-11,3,機械商社中堅。産業向け主力で設備、高機能材料も。海外販路に強み。\n産業向け機械、設備、高機能材料の専門商社。海外販路に強み。周辺事業のＭ＆Ａに積極的
0,8095,イワキ,0,25,1000,http://www.iwaki-kk.co.jp/,1941-09-20,1963-07-01,11,医薬品・医薬原料商社。自社系列品の扱い比率高い。化成品なども扱う。\n一般医薬品・医薬原料商社。化成品も展開。傘下にジェネリック（後発）薬やメッキ製造子会社
0,8097,三愛石油,0,25,1000,http://www.san-ai-oil.co.jp/,1947-01-21,1961-10-01,3,石油・LPG卸大手。羽田で給油施設運営なども。傘下にキグナス石油。\n旧モービル主体の石油・ＬＰガス卸大手。傘下にキグナス石油。羽田空港で給油施設運営等も
0,8098,稲畑産業,0,25,100,http://www.inabata.co.jp/,1918-06-10,1961-10-01,3,化学専門商社。電子材料や合成樹脂に強み。アジアで広域に展開。\n化学専門商社。住友化学系だが稲畑オーナー色も。情報電子、合成樹脂が柱。アジア広域展開
0,8101,ＧＳＩクレオス,0,25,1000,http://www.gsi.co.jp/,1931-10-31,1973-02-01,3,繊維主力の専門商社。繊維原料と婦人服が柱。工業製品を育成へ。\n繊維を中心とする専門商社。原糸と生地、婦人服ＳＰＡが柱。工業製品を育成中。旧グンゼ産業
0,8103,明和産業,0,25,100,http://www.meiwa.co.jp/,1947-07-25,1973-04-01,3,三菱系商社中堅。化学品・樹脂主力。炭素製品などで高シェア。中国に強み。\n化学品、樹脂主体の中堅商社。炭素製品、難燃助剤等で高シェア。中国での潤滑油販売にも強み
0,8104,クワザワ,6,25,0,http://www.kuwazawa.co.jp/,1951-02-01,1973-09-01,3,北海道地盤の建設資材商社。住宅関連主力。建設工事も。太平洋セメント系。\n北海道地盤の建材・土木資材商社。建設工事も行う。近年はリフォーム、住宅設備機器に進出
0,8105,堀田丸正,1,25,1000,http://www.pearly-marusho.co.jp/,1933-02-01,1974-04-01,3,繊維商社中堅。呉服問屋から出発、和装・洋装が中心。ヤマノグループ傘下。\nヤマノグループ。呉服問屋起源の中堅繊維商社丸正が０７年同業堀田産業と合併、洋装など４事業
0,8108,ヤマエ久野,11,25,0,http://www.yamaehisano.co.jp/,1950-04-27,1974-10-01,3,九州地盤の食品卸大手。食品・糖粉・飼料が主力。住宅や物流受託なども。\n九州主体に西日本が地盤の食品卸売り大手。量販店の物流受託事業、住宅・建材などに多角化
