0,3830,ギガプライズ,10,24,0,http://www.gigaprize.co.jp/,1997-02-07,2006-12-15,3,マンション向けネット接続サービスを展開。システム開発も。フリービット傘下。\nフリービット傘下のマンション向けネット接続会社。親会社と協業。システム開発も手掛ける
0,3832,Ｔ＆Ｃホールディングス,3,24,100,http://www.tandch.com/,2001-08-01,2006-12-25,11,祖業の投資情報から事実上撤退。医療機器製造販売を主力に転換。\n投資情報の提供が祖業。同事業は事実上の撤退で縮小。医療機器製造販売に注力。事業再建中
0,3834,朝日ネット,0,24,100,http://asahi-net.jp/,1990-04-02,2006-12-26,3,独立系のネット接続大手。「ASAHIネット」を運営。クラウド型教育支援サービスも。\n独立系のネット接続サービス（ＩＳＰ）大手。「ＡＳＡＨＩネット」運営。大学向けＳＮＳ事業も
0,3835,ｅＢＡＳＥ,2,24,100,http://www.ebase.co.jp/,2001-10-01,2006-12-26,3,商品情報データベースソフトの開発・販売。「eBASE」など。トレーサビリティー管理で注目。\n商品情報管理ソフト「ｅＢＡＳＥ」を開発、販売。食品業界間でのトレーサビリティ用途が主軸
0,3836,アバント,3,24,100,http://www.avantcorp.com/,1997-05-26,2007-02-08,6,連結会計ソフトを開発。損益計算書などの作成支援。ライセンス販売、導入サービスも。\n連結経営・会計システムのパッケージソフト開発、ライセンス販売、導入サービスなど展開
0,3837,アドソル日進,2,24,100,http://www.adniss.jp/,1976-03-13,2007-02-19,3,ソフト開発の老舗。大企業向け大規模システム開発に強み。ユビキタス事業なども。\n大企業向け大規模システムの開発に強み持つ。技術水準に定評。ソリューション提案を強化
0,3839,ＯＤＫソリューションズ,2,24,100,http://www.odk.co.jp/,1963-04-01,2007-03-08,3,システム開発・運営会社。入試関連など、教育分野に強み。筆頭株主は学研HD。\nシステム開発・運営会社。入試関連支援業務が主力。利益は下期集中。学研ＨＬＤが筆頭株主に
0,3840,パス,4,24,100,http://www.pathway.co.jp/,1990-05-02,2007-03-12,3,再生コンサル事業などで再建中。決済代行や旅行事業も。メディア事業に参入。\n企業再生の専門家２人をトップに招聘。再生コンサル事業と出資子会社の再生で立て直し図る
0,3841,ジーダット,2,24,100,http://www.jedat.co.jp/,2003-11-21,2007-03-15,3,LSI・液晶パネル設計用のCADソフトを開発・販売。海外注力。アルゴグラフィックス傘下。\nＬＳＩや液晶パネル設計用の電子系ＣＡＤソフト（ＥＤＡ）を開発・販売。海外提携に積極的
0,3842,ネクストジェン,3,24,100,http://www.nextgen.co.jp/,2001-11-16,2007-03-14,3,次世代通信網の制御システム開発。保守やサポートも。SIPのパイオニア。\n次世代通信網（ＮＧＮ）の制御システム開発会社。ＳＩＰ（通話制御プロトコル）の先駆的存在
0,3843,フリービット,4,24,100,http://www.freebit.com/,2000-05-01,2007-03-20,4,ネットビジネスを支援。ネット接続業者にインフラ提供サービス。アドテクノロジー事業も。\nネット接続業者向けにインフラ提供サービスを展開。独自スマホ事業はＣＣＣとの合弁に移行
0,3844,コムチュア,0,24,100,http://www.comture.com/,1985-01-18,2007-03-20,3,独立系SI。グループウエア運用でトップクラス。コンサルも。クラウドやウェブ構築を強化。\n独立系ＳＩ。グループウエアは首位級。持株経営移行しクラウド、Ｗｅｂ構築、ネット運用強化
0,3845,アイフリークモバイル,2,24,100,http://www.i-freek.co.jp/,2001-12-01,2007-03-19,3,携帯向けに情報配信。「デコメール」サイトを運営。スマホ向けアプリやLINEスタンプも。\n携帯向け情報配信が主、メール装飾画像、ＬＩＮＥスタンプも。１５年７月事業会社に先祖返り
0,3847,パシフィックシステム,2,24,100,http://www.pacific-systems.co.jp/,1980-08-14,2007-04-19,3,情報サービス会社。自社開発ソフトに強み。親会社の太平洋セメント向けが約３割。\n太平洋セメント系の情報サービス業。画像処理に強み。親会社向け販売３割で、顧客開拓が課題
0,3848,データアプリ,2,24,100,https://www.dal.co.jp/,1982-09-27,2007-04-25,3,ITベンチャー。企業向けEDIソフト開発で首位。大手SIなどからの受注が主体。\n企業間電子商取引などデータ交換向けソフトが主力。大手ＳＩなど販売代理店経由の受注中心
0,3849,日本テクノ・ラボ,7,24,0,http://www.ntl.co.jp/,1989-01-31,2007-05-22,3,独立系ソフト開発会社。プリンタ制御ソフトに強み。セキュリティ関連を育成へ。\n産業用特殊プリンタに特化した制御システムソフト開発・販売が柱。セキュリティ関連を強化
0,3850,ＮＴＴＤイン,4,24,100,http://www.intra-mart.jp/,2000-02-22,2007-06-07,3,NTTデータ子会社でシステム開発・販売会社。ウェブシステム基盤構築などに強み。\nＮＴＴデータの社内ベンチャー発祥。Ｗｅｂシステム基盤構築のためのソフト開発・販売が主
0,3851,日本一ソフトウェア,2,24,100,http://www.nippon1.co.jp/index.html,1995-07-01,2007-06-13,3,ソニーのPS3・PSP用を主力とするゲームソフトメーカー。スマホ向けゲームアプリにも注力。\nゲームソフトメーカー。ＳＣＥのＰＳ３、ＰＳＰ用が柱。ＲＰＧ「ディスガイア」シリーズなど
0,3852,サイバーコム,1,24,100,http://www.cy-com.co.jp/,1978-12-04,2007-06-19,3,富士ソフト子会社。通信機器関連のソフト開発が主力。自社プロダクトも提供。\n富士ソフトの子会社。通信分野を中心としたソフトウエア開発が主力。自社プロダクトも提供
0,3853,インフォテリア,4,24,100,http://www.infoteria.com/,1998-09-01,2007-06-22,3,システム開発会社。XML専門のソフト開発は日本初。企業のシステム連携ソフトが主力。\n日本初のＸＭＬ専門ソフト開発会社。企業向けのデータ連携ソフト「アステリア」が主力
0,3854,アイル,3,24,100,http://www.ill.co.jp/,1991-02-25,2007-06-29,7,独立系システム開発会社。中小向け中心。ネットショップと実店舗の総合管理も。\n中堅・中小企業向け販売在庫管理システムを開発。実店舗とネットショップの統合管理に展開
0,3856,リアルコム,4,24,100,http://www.realcom.co.jp/,2000-04-17,2007-09-19,6,創業のソフト開発・販売から主力を太陽光発電事業にシフト。建機販売も。\n企業向けソフト開発・販売で創業。１１年に建機商社ＷＷＢと株式交換。現在の主力は太陽光事業
0,3857,ラック,2,24,100,http://www.lac.co.jp/,2007-10-01,2007-10-01,3,ソフト開発会社。情報セキュリティ技術に強み。KDDIと資本提携、関係強化。\n情報セキュリティ技術に強い。１４年ＫＤＤＩと資本提携、戦略立案の人材も招聘し関係一段強化
0,3858,ユビキタス,2,24,100,http://www.ubiquitous.co.jp/,2001-05-07,2007-11-13,3,組み込みソフトの開発ベンチャー。車載機器向けの収益基盤構築を急ぐ。\n組み込みソフトの開発型ベンチャー。柱だった任天堂ＤＳ向けに代わる収益基盤構築が急務
0,3900,クラウドワークス,4,24,100,http://crowdworks.jp/,2011-11-11,2014-12-12,9,クラウドソーシングで国内首位級。大企業向けに強み。人材マッチング事業も主力。\n国内最大級のクラウドソーシング会社。ネット上の人材マッチング事業と大企業向け事業が柱
0,3901,マークラインズ,2,24,100,http://www.marklines.com/,2001-01-04,2014-12-16,12,自動車産業に関するポータルサイトを運営。海外にも展開。コンサルや人材紹介も。\n自動車産業特化のＷｅｂ情報サービス。日英中３言語対応。コンサルティングや人材紹介も展開
0,3902,ＭＤＶ,4,24,100,http://www.mdv.co.jp/,2003-08-20,2014-12-16,12,病院経営支援ソフト「EVE」が主力。製薬向けに医薬品データの利活用サービスも。\n医療機関、製薬向けに医療・医薬品データのネットワーク化と利活用の両サービスを提供
0,3903,ｇｕｍｉ,0,24,100,http://gu3.co.jp/,2007-06-13,2014-12-18,4,ソーシャルゲームからスマホアプリ開発が主力に。海外に強み。他社ゲームの海外配信も。\nソーシャルゲームからスマホアプリへシフト。他社ゲームの海外配信も。海外９拠点で開発
0,3904,カヤック,4,24,100,http://www.kayac.com/,2005-01-21,2014-12-25,12,ネット広告、ソーシャルゲーム配信が主力。ゲームコミュニティ「Lobi」も運営。開発力に強み。\nネット広告コンテンツ制作、ソーシャルゲームが主力。ゲームコミュニティ「Ｌｏｂｉ」も運営
0,3905,データセクション,4,24,100,http://www.datasection.co.jp/,2000-07-11,2014-12-24,3,ビッグテータを処理・分析。ソーシャルメディアに強み。企業にマーケティング支援ツールを提供。\nビッグデータ処理・解析。特にＳＮＳ等ソーシャルメディアに強み。データ活用システムも開発
0,3906,ＡＬＢＥＲＴ,4,24,100,http://www.albert2005.co.jp/,2005-07-01,2015-02-19,12,ビッグデータを利用したマーケティング支援システムを提供。\nビッグデータを活用した販促分析が主力。流通向け中心。分析基盤サービス９割、コンサル１割
0,3907,シリコンスタジオ,4,24,100,http://www.siliconstudio.co.jp/,1999-11-22,2015-02-23,11,3次元のCG技術を活用し、ゲーム開発を支援する事業が主力。\n３ＤＣＧ技術基盤のゲーム用ミドルウエアが主力。開発受託、人材派遣に加え自社ゲーム開発
0,3908,コラボス,4,24,100,http://www.collabos.com/,2001-10-26,2015-03-17,3,コールセンター向けにクラウドシステムを手掛ける。\n企業のコールセンター向けクラウドシステムを提供、初期導入費用と運用課金が収益源
0,3909,ショーケース,4,24,100,http://www.showcase-tv.com/,1998-09-01,2015-03-19,12,ウェブサイトをスマートフォン向けに最適化するクラウドサービスを手掛ける。\nＷｅｂサイト最適化技術により成約率高めるｅマーケティング事業展開。日米などで特許取得
0,3910,エムケイシステム,2,24,100,http://www.mks.jp/,1989-02-22,2015-03-17,3,社会保険や労働保険に関する業務支援ソフトウエアを手掛ける。\n社会保険労務士事務所、労働保険事務組合向けにＡＳＰサービス提供、大企業向けにも進出
0,3911,Ａｉｍｉｎｇ,4,24,100,http://aiming-inc.com/ja,2011-05-12,2015-03-25,12,スマートフォンやパソコン向けゲームの開発配信を手掛ける。\nスマホゲーム配信、制作・運営受託。多人数同時接続のＭＭＯに強み。アジア向け配信に積極的
0,3912,モバイルファクトリー,4,24,100,http://www.mobilefactory.jp/,2003-04-01,2015-03-26,12,スマホ向け交流ゲームなどコンテンツサービスの開発配信を手掛ける。\nスマホ・従来型携帯向け交流ゲームや着メロの開発・配信会社。位置情報連動型ゲームに注力
0,3913,ｓＭｅｄｉｏ,4,24,100,http://www.smedio.co.jp/,2007-03-16,2015-03-27,12,異なる機器同士を、Wi-Fiなどの無線通信でつなぐソフトを販売。\nデジタル家電組み込みとネット接続関連ソフトが柱。開発型収益からライセンス収入を拡大
0,3914,ジグソー,4,24,100,https://www.jig-saw.com/,2001-11-01,2015-04-28,12,企業が運営するインターネットのネットワークの監視や保守業務を手掛ける。\nクラウドやサーバーを対象にした自動監視システムを展開。初期導入費と月額使用料が収益源
0,3915,テラスカイ,4,24,100,http://www.terrasky.co.jp/,2006-03-09,2015-04-30,2,クラウドシステムの導入支援や、開発事業を展開。\nクラウドシステムの導入支援・開発事業を展開。米国の大手・セールスフォース社と業務提携
0,3916,ＤＩＴ,2,24,100,http://www.ditgroup.jp/,2002-01-04,2015-06-18,6,サイバー攻撃に備える情報セキュリティーシステムの構築を手掛ける。\n独立系情報サービス会社。ソフトウエア開発の比重が９割超。金融、通信などに顧客企業多い
0,3917,アイリッジ,4,24,100,http://iridge.jp/,2008-08-29,2015-07-16,7,スマートフォンをプラットホームとして実店舗へ集客するO2Oの支援事業を手掛ける。\n集客、販促でネット・実店舗連携の「ＯｔｏＯ」施策支援。スマホ位置情報連携サービスを展開
0,3918,ＰＣＩホールディングス,4,24,100,http://www.pci-h.co.jp/,2005-04-11,2015-08-04,9,自動車や重機・建機などに組み込むソフト開発を手掛ける。\n傘下にソフト開発３社。自動車、家電などの組み込みソフト開発が主力。ＩｏＴ開発も手掛ける
0,3919,パイプドＨＤ,0,24,100,http://www.pipedohd.com/,2015-09-01,2015-09-01,2,顧客情報を管理・運用するソフトを期間貸し方式で企業などに提供する。\n１５年９月持株会社に。ネットでのデータ管理「スパイラル」が柱。月額サービス料が売上の大半
0,3920,アイビーシー,4,24,100,http://www.ibc21.co.jp/,2002-10-16,2015-09-15,9,社内システムの性能監視ソフトの開発と販売、運用支援サービスを手掛ける。\n-
0,4284,ソルクシーズ,2,24,100,http://www.solxyz.co.jp/,1981-02-04,2001-07-17,12,金融機関向けシステム開発とソフトの受託開発が主力。クラウド事業を本格化。\nＳＢＩ社の持分法適用のＳＩ会社。信販、証券など金融業界が主顧客。クラウド事業を本格推進
0,4287,ジャストプランニング,2,24,100,http://www.justweb.co.jp/,1998-06-01,2001-07-24,1,外食店向けソフト開発のASP事業者。店舗管理ソフトなどを提供。IMCと提携。\n外食業界に特化した業務ソフト開発・運用のＡＳＰ事業者。スマホアプリ開発のＩＭＣと提携
0,4288,アズジェント,2,24,100,http://www.asgent.co.jp/,1997-11-10,2001-07-31,3,セキュリティーソフトを輸入販売。構築や運用など高付加価値サービス事業にシフト。\nセキュリティソフト輸入販売から構築・運用等含めた高付加価値サービス事業へ転換。独立系
0,4291,ＪＩＥＣ,1,24,100,http://www.jiec.co.jp/,1985-09-05,2001-07-31,3,SCSKグループのソフト開発会社。金融、運輸、旅行等に強み。統合技術に定評。\nＣＳＫ（現ＳＣＳＫ）と日本ＩＢＭの合弁で出発したソフト開発会社。保険、銀行、運輸に強い
0,4295,フェイス,0,24,100,http://www.faith.co.jp/,1992-10-09,2001-09-04,3,音楽・映像中心のコンテンツ配信が主力。レコード会社も運営。ネットラジオを育成へ。\n柱は着信メロディから１４年連結の日本コロムビアの音楽・映像に。楽曲推薦ネットラジオ育成
0,4298,プロトコーポレーション,2,24,100,http://www.proto-g.co.jp/,1979-06-01,2001-09-12,3,中古車情報誌「Goo」を発行。データ登録と広告収入が収益の柱。ネットを拡充。\n中古車情報誌を発行。中古車販売店のデータ登録・広告収入が主柱。独自のＷｅｂサイトを拡充
0,4299,ハイマックス,0,24,100,http://www.himacs.jp/,1976-05-21,2001-09-17,3,独立系SI。金融機関向けに強み。保険やクレジット等も。流通分野開拓に力。\n独立系ＳＩ。金融、保険、流通、クレジットカードが主体。野村総研、ＩＢＭ、富士通向け多い
0,4304,Ｅストアー,2,24,100,http://estore.co.jp/,1999-02-17,2001-09-19,3,電子商取引支援会社。Webショップ運営支援が主力。レンタルサーバーなど提供。\nＷｅｂ店舗運営支援サービスが柱。広告など出店店舗販促支援も。ヤフーとの資本提携は解消
0,4307,野村総合研究所,0,24,100,http://www.nri.com/jp/,1966-01-05,2001-12-17,3,システム構築大手。コンサル・開発・運営と一貫。金融機関向けに強み。野村証券系。\n野村証券系ＳＩ。コンサル、システム開発・運用の一貫体制。顧客は金融機関と流通業が中心
0,4308,Ｊストリーム,4,24,100,http://www.stream.co.jp/,1997-05-29,2001-09-21,3,ストリーミング配信でネット動画ライブ中継やオンデマンド放送を提供。映像制作も。\nネットによる動画ライブ中継やオンデマンド放送の配信インフラ提供。映像制作等も手掛ける
0,4312,サイバネットシステム,0,24,100,http://www.cybernet.jp/,1985-04-17,2001-10-31,12,富士ソフト子会社。設計用CAEソフトが柱。ライセンス販売が大半。仮想実験用等も。\n富士ソフト子会社。設計用ＣＡＥソフト主力。ライセンス販売が約７割占める。自社品強化中
0,4316,ビーマップ,3,24,100,http://www.bemap.co.jp/,1998-09-04,2002-01-30,3,無線LANシステムの構築が成長中。JR・道路など交通関連、位置情報サービスなど。\nＪＲ・道路など交通関連、位置情報、画像配信サービスを展開。無線ＬＡＮシステム構築を拡大中
0,4320,ＣＥホールディングス,0,24,100,http://www.ce-hd.co.jp/,1996-03-25,2001-10-31,9,電子カルテシステムを自社開発。中小病院向けに強み。NDソフトと技術提携。\n電子カルテシステムを自社開発。中小病院向けに強み。ＮＥＣなど大手ＩＴとの協業も強化
0,4323,日本システム技術,1,24,100,http://www.jast.jp/,1973-03-26,2001-11-06,3,システムの開発・販売。ソフトの受託開発やパッケージ、医療ビッグデータなども柱。\n独立系のシステム開発。ソフト開発、パッケージ、システム販売、医療ビッグデータが４本柱
0,4326,インテージＨ,0,24,100,http://www.intageholdings.co.jp/,1972-09-11,2001-11-29,3,パネル調査で国内首位。消費と販売の両パネル調査網を持つのは国内で唯一。\n日本で唯一、消費、販売の両パネル調査網持つ。市場調査分野で国内首位、１３年１０月持株会社に
0,4333,東邦システムサイエンス,0,24,100,http://www.tss.co.jp/,1971-06-01,2001-12-19,3,独立系のソフト開発中堅。金融機関向けが主力。NRIやユニシスなどと連携。\n旧東邦生命系から独立したソフト開発中堅。ＮＲＩ、日ユニシス、富士通等と連携。金融系が得意
0,4334,ユークス,2,24,100,http://www.yukes.co.jp/,1996-06-01,2001-12-21,1,ゲームソフトを受託開発。プロレス関連に強く北米向け中心。パチスロ向けなども。\nゲームソフトの受託開発。プロレス関連得意で北米向けが主。自社ソフト開発、パチンコ向けも
0,4335,アイ・ピー・エス,2,24,100,http://www.ips.ne.jp/,1997-06-20,2001-12-20,6,神戸地盤の情報システム開発会社。企業向け中心でコンサルも。ERP導入を支援。\n神戸地盤に企業向け情報システム開発を行う。ＳＡＰのＥＲＰを中心に販売。首都圏を強化中
0,4344,ソースネクスト,0,24,100,http://www.sourcenext.com/,1996-08-02,2006-12-20,3,PCソフトの開発会社。一般消費者向け低価格パッケージに強み。ウイルス対策も。\nＰＣ用低価格パッケージソフトが中心。ウイルス対策はシェア上位。スマホ向けアプリ急成長中
0,4348,インフォコム,2,24,100,http://www.infocom.co.jp/,1983-02-12,2002-03-19,3,情報システム構築会社。ネット配信と両輪。電子書籍で最大手級。医療関連強化。\nシステム開発とネット配信の２本柱。電子書籍首位級。医療関連や統合業務管理ソフト等強化中
0,4349,テスク,9,24,0,http://www.kktisc.co.jp/,1974-04-10,2002-03-18,3,流通業向けシステム開発とハード販売が主力。中堅スーパー向けPOSなどが柱。\n小売り・卸業界を主顧客とする基幹系システム開発および電算ハード販売。日本ＩＢＭと密接
0,4356,応用技術,2,24,100,http://www.apptec.co.jp/,1984-06-14,2002-04-16,12,ソフト・コンサルのトランスコスモス子会社。業務効率化ソフトが主力。環境解析に定評。\nトランスコスモス傘下のソフト・コンサル会社。住宅用業務改善ソフトが主力。環境解析に実績
0,4358,ティー・ワイ・オー,0,24,100,http://group.tyo.jp/,1982-04-02,2002-04-24,7,映像制作大手。CMやアニメなどを制作。インドネシアなど海外にも積極展開。\n大手ＣＭ制作会社の一角、アニメ制作も展開。広告主と直接取引を拡大中。配当性向２５％以上
0,4640,アンドール,2,24,100,http://www.andor.co.jp/,1972-09-01,1996-06-13,3,設計開発のエンジニアリングサービスが主力。CAD・CAMのパッケージソフト中心。\n主力は設計開発のエンジニアリングサービス。ＣＡＤ／ＣＡＭの開発、販売。ＴＣＳが筆頭株主
0,4644,イマジニア,2,24,100,http://www.imagineer.co.jp/,1986-01-27,1996-07-19,3,携帯コンテンツの企画・配信。パッケージソフトの開発やキャラクターのライセンス商品販売も。\nモバイルコンテンツ配信、企画が柱。パッケージソフト、キャラクターのライセンス商品販売も
0,4662,フォーカスシステムズ,1,24,100,http://www.focus-s.com/,1977-04-01,1996-12-13,3,独立系ソフト開発会社。官公庁などからの受託開発が主力。保守・運用強化。\n通信分野でのオンラインソフト開発に強い。保守・運用サービスも。独自の暗号システムに進出
0,4667,アイサンテクノロジー,2,24,100,http://www.aisantec.co.jp/,1970-08-12,1997-04-09,3,測量・土木ソフトの開発販売が主力。移動式高精度3次元計測システムに注力。\n測量、土木ソフト開発販売が主柱。ハード、保守も。３次元位置情報移動計測装置（ＭＭＳ）注力
0,4674,クレスコ,0,24,100,http://www.cresco.co.jp/,1988-04-01,1997-07-23,3,独立系のソフト開発会社。業務用主力。携帯など組み込みソフト開発も。\n受託によるソフト開発主力、金融系に強い。携帯等の組み込みソフト開発も手掛ける。独立系
0,4676,フジＨＤ,0,24,100,http://www.fujimediahd.co.jp/,1957-11-18,1997-08-08,3,フジサンケイグループの認定放送持株会社。若年層に強み。音楽・通販など多角化。\nフジサンケイグループ。若年層強いが視聴率首位争いから後退。音楽、通販、不動産など多角経営
0,4684,オービック,0,24,100,http://www.obic.co.jp/,1968-04-08,1998-12-17,3,独立系SI。企画から保守まで一貫。主力のERPは中小から大企業に拡大。\n独立系ＳＩ。主軸のＥＲＰが中小・中堅から大企業向けに拡大。持分にＯＢＣ。キャッシュ潤沢
0,4685,菱友システムズ,2,24,1000,http://www.ryoyu.co.jp/,1968-07-05,1997-10-01,3,三菱重工系総合情報サービス会社。ソフト開発や情報処理が主力。機器販売も。\n三菱重工系。情報処理、ソフト開発、設計解析、システム機器販売が柱。ＩＢＭの有力特約店
0,4686,ジャストシステム,0,24,100,http://www.justsystems.com/jp/,1981-06-02,1997-10-16,3,文書作成ソフト大手。「ATOK」が主力。日本語処理技術に強み。教育分野開拓。\nワープロ一太郎やＡＴＯＫが主力。学習支援ソフトなど教育分野も開拓。キーエンスと資本提携
0,4687,ＴＤＣソフト,0,24,100,http://www.tdc.co.jp/,1963-12-17,1997-10-16,3,独立系SI。金融・流通関連ソフト開発に強み。クラウド対応の自社製品を育成。\n金融関連ソフトの開発に強み持つ独立系ＳＩ。クラウドに対応した自社製品の育成に注力中
0,4689,ヤフー,0,24,100,http://www.yahoo.co.jp,1996-01-31,1997-11-04,3,ネットサービスのパイオニア。ネット広告とECサイトが主力。スマホへのサービスを推進。\nネットサービス先駆。ＰＣ向けネット広告、ＥＣが柱。サービスのスマホ化推進。株主還元強化 [企業特色]
0,4704,トレンドマイクロ,0,24,100,http://www.trendmicro.co.jp/,1989-10-24,1998-08-18,12,法人用ウイルス対策ソフトで国内首位。世界でも高シェア。「ウイルスバスター」が主力。\n情報セキュリティソフト「ウイルスバスター」が高シェア。個人、法人用で国内首位。世界３位
