0,3087,ドトル日レス,0,26,100,http://www.dnh.co.jp/,2007-10-01,2007-10-01,2,ドトールと日本レストランが統合。低価格カフェ店やパスタ店を展開。\n傘下にＦＣ主体の喫茶ドトール、「星乃珈琲店」展開する日レスなど。コーヒー類の卸売りも
0,3088,マツキヨＨＤ,0,26,100,http://www.matsumotokiyoshi-hd.co.jp/,2007-10-01,2007-10-01,3,ドラッグストア最大手。関東圏に強み。ＦＣやＭ＆Ａも積極展開。\n中小チェーンの買収繰り返し売上高でドラッグストア首位に。ＦＣにも積極的。関東圏に強み
0,3091,ブロンコビリー,0,26,100,http://www.bronco.co.jp/,1983-12-26,2007-11-02,12,名古屋地盤に高級ステーキ店をチェーン展開。魚沼産コシヒカリなどに特徴。関東に進出。\n名古屋地盤。炭焼きステーキ等を提供する郊外型高価格レストラン。関東出店を本格化。好財務
0,3092,スタートトゥデイ,0,26,100,http://www.starttoday.jp/,2000-04-01,2007-12-11,3,衣料品通販サイト「ZOZOTOWN」を運営。ブランド品を受託販売、手数料が収益源。\n衣料品ネット通販「ＺＯＺＯＴＯＷＮ」運営。アパレルブランドからの受託販売手数料が収益源
0,3093,トレファク,0,26,100,http://www.treasurefactory.co.jp/,1999-12-01,2007-12-26,2,首都圏でリサイクル店を展開。家電・家具・雑貨など品揃え多彩。関西にも進出。\n家電、家具、雑貨等の総合リサイクル店を展開。関東１都４県が地盤、関西へも出店を開始
0,3094,スーパーバリュー,2,26,100,http://www.supervalue.jp/,1996-03-18,2008-02-15,2,埼玉県を中心に食品スーパーとＨＣを併設した複合小売店舗を展開。\n埼玉を主地盤にホームセンター（ＨＣ）と食品スーパーの併設店舗などを展開。ローコスト運営
0,3096,オーシャンシステム,2,26,100,http://www.ocean-system.com/,1978-11-01,2008-03-19,3,新潟地盤に食品スーパーなど展開。低価格で提供。弁当製造や食材宅配も。\n新潟地盤に独自食品スーパー「チャレンジャー」や業務スーパー展開。弁当や宅配、旅館経営も
0,3097,物語コーポレーション,0,26,100,http://www.monogatari.co.jp/,1969-09-04,2008-03-26,6,中部地盤の外食中堅。焼肉店が主力。ラーメンやお好み焼きなど新業態開発も。\n中部地盤。直営・ＦＣで郊外に出店。食べ放題店「焼肉きんぐ」が主力。ラーメンやお好み焼きも
0,3098,ココカラファイン,0,26,100,http://www.cocokarafine.co.jp/,2008-04-01,2008-04-01,3,セイジョーとセガミが統合、全国でドラッグストア展開。アライドハーツHDと合併。\nドラッグストア大手。関東「セイジョー」、関西「セガミ」などが統合し０８年誕生。屋号を順次統一
0,3099,三越伊勢丹,0,26,100,http://www.imhds.co.jp/,2008-04-01,2008-04-01,3,百貨店最大手。08年４月に三越と伊勢丹が統合。幅広い顧客層に強み。\n百貨店首位。０８年４月の経営統合で誕生。旗艦店の新宿伊勢丹、日本橋三越は全国屈指の売上高
0,3133,海帆,4,26,100,http://www.kaihan.co.jp/,2006-10-01,2015-04-17,3,居酒屋チェーン。東海地区地盤に、レトロな内装の居酒屋「昭和食堂」などを展開。\n東海地方を中心に飲食店を直営展開。レトロな雰囲気の内装が特徴の居酒屋「昭和食堂」が主体
0,3134,Ｈａｍｅｅ,4,26,100,http://hamee.co.jp/,2001-12-01,2015-04-20,4,スマホなどモバイル機器関連アクセサリーを企画販売。EC事業支援システムの開発・提供も。\nスマホやタブレット向けアクセのデザイン・販売。クラウド型ＥＣ事業支援システムも展開
0,3135,マーケットＥ,4,26,100,http://www.marketenterprise.co.jp/,2006-07-07,2015-06-17,6,インターネットに特化した多種多様なリユース品の買い取りや販売を手掛ける。\nＷｅｂ上でリユース品買取を行う「高く売れるドットコム」等展開。買取用の物流拠点拡充中
0,3136,エコノス,7,26,0,http://www.eco-nos.com/,1964-03-01,2015-06-24,3,北海道で古書店や中古家電店を展開。環境コンサルタント事業にも注力。\n北海道で、ブックオフ、ハードオフの加盟店として中古店を展開、環境コンサル等も手掛ける
0,3137,ファンデリー,4,26,100,http://www.fundely.co.jp/,2000-09-25,2015-06-25,3,健康食通販カタログによる健康食宅配サービスを手掛ける。\n生活習慣病患者向けなど健康食を宅配。医療機関等にカタログ配布・紹介ネットワークを持つ
0,3138,富士山マガジンサービス,4,26,100,http://www.fujisan.co.jp/,2002-07-12,2015-07-07,12,自社サイトで雑誌の定期購読あっせんサービスを運営。\n個人・法人に雑誌の定期購読を提供するオンライン書店。出版社からの販売手数料が収益柱
0,3141,ウエルシア,0,26,100,http://www.welcia.co.jp/,2008-09-01,2008-09-01,2,イオン系ドラッグ大手。ウエルシア関東と高田薬局が統合。調剤薬局併設店に強み。\nウエルシア関東と高田薬局が統合。調剤薬局併設店舗に強み。イオン子会社、９月ＣＦＳを統合
0,3147,リックコーポレーション,2,26,100,http://www.lic.jp/,1955-03-24,2008-12-17,2,中四国などでホームセンターとペット店を運営。自転車など専門店も。\n岡山地盤にホームセンター（ＨＣ）とペット店を展開。自転車や農業資材、酒販売など専門店も
0,3148,クリエイトＳ,0,26,100,http://www.createsdhd.co.jp/,2006-11-22,2009-03-01,5,神奈川地盤の大手ドラッグチェーン。首都圏に大型店を展開。介護事業も。\n神奈川県地盤の大手ドラッグストアチェーン。デイサービスなど介護事業も。関東近県に拡大
0,3159,丸善ＣＨＩ,0,26,100,http://www.maruzen-chi.co.jp/,2010-02-01,2010-02-01,1,大日印傘下。丸善と図書流通センタ-が統合。輸入図書、学術機関向けに強み。\n丸善とＴＲＣが統合。１１年に書店大手のジュンク堂、学術書の雄松堂も参加。大日本印刷傘下
0,3169,ミサワ,0,26,100,http://www.unico-fan.co.jp/,1959-02-26,2011-12-22,1,「unico」ブランドで家具・インテリア雑貨などを製造販売。飲食店も展開。\n「ｕｎｉｃｏ」ブランドで家具・雑貨など展開。２０〜３０代の女性が中心顧客。飲食店も運営
0,3170,アイセイ薬局,2,26,100,http://www.aisei.co.jp/,2000-08-22,2011-12-22,3,関東・東海に調剤薬局を展開。医療モール開発で先駆。介護福祉施設で実績。\nかかりつけ薬局軸に東名阪中心の展開。医療モール開発で業界先駆。介護福祉施設も実績豊富
0,3171,マックスバリュ九州,2,26,100,http://www.mv-kyushu.co.jp/,2002-03-25,2012-02-22,2,九州地盤のイオン系食品スーパー。郊外の中型店が主力。ディスカウントストアも運営。\n九州のイオン系食品スーパー。破綻した壽屋の受け皿として設立。ディスカウント（ＤＳ）も運営
0,3172,ティーライフ,1,26,100,http://www.tealifeir.com/,1983-08-26,2012-03-06,7,自社企画の健康茶、健康食品、化粧品などをカタログ・ネットで通販。M&Aに意欲。\nＰＢ健康茶、化粧品などをカタログ、ネットで販売。製品製造など外部に委託。Ｍ＆Ａに意欲
0,3174,ハピネス・アンド・ディ,2,26,100,http://www.happiness-d.co.jp,1990-09-05,2012-06-22,8,国内外のバッグ、宝飾などブランド品を販売。SC中心に全国展開。PBを拡充。\n宝飾、時計、バッグ、雑貨などギフト品販売。北海道から沖縄までＳＣ軸に全国展開。ＰＢに注力
0,3175,エー・ピーカンパニー,0,26,100,http://www.apcompany.jp,2006-06-05,2012-09-25,3,首都圏で居酒屋を展開。「塚田農場」が主力。地鶏も育成、販売に直結。\n都内中心に居酒屋「塚田農場」等を展開。自社農場で地鶏を育成するなど生産・販売の直結が特徴
0,3177,ありがとうサービス,2,26,100,http://www.arigatou-s.com/,2000-10-31,2012-11-12,2,ブックオフ、ハードオフをFC展開。外食はモスバーガーFCが主力。愛媛地盤、九州強化。\nブックオフ、ハードオフＦＣ。フードはモスバーガーＦＣと自社展開。愛媛地盤に九州出店強化
0,3178,チムニー,0,26,100,http://www.chimney.co.jp/,2009-09-16,2012-12-14,12,居酒屋大手。「はなの舞」「さかなや道場」を展開。13年からやまやの傘下。\n居酒屋「はなの舞」「さかなや道場」を直営・ＦＣ展開。受託食堂を育成中。酒販店やまやの傘下に
0,3179,シュッピン,4,26,100,http://www.syuppin.co.jp/,2005-08-04,2012-12-20,3,専門性高い商品の中古品を買い取り販売。カメラ・時計が主軸。新品販売も。\nカメラを軸に専門性高い商材の中古品や新品をネットと店舗で販売。社長はソフマップ創業者
0,3181,買取王国,2,26,100,http://www.okoku.jp/,1999-10-13,2013-02-14,2,衣料などの中古品販売をする「買取王国」を愛知や大阪などで運営する。\n中古品の買い取り、再販事業。衣料、ホビーが主体、ロードサイド店「買取王国」を東海地盤に展開
0,3182,オイシックス,4,26,100,http://www.oisix.com/,2000-03-31,2013-03-13,3,契約農家の青果物などをネット販売。農薬や添加物に配慮。実店舗で販売も。\n農薬や添加物の使用に配慮した青果物や加工食品などをネット販売。リアル店舗での販売も
0,3184,ＩＣＤＡ,1,26,100,http://www.icda.jp/,2009-10-01,2013-06-27,3,三重地盤のホンダ系ディーラー。新車販売、中古車買い取り・販売、リサイクルを展開。\n三重県拠点のホンダ系ディーラー。ＶＷやアウディなど輸入車販売、自動車リサイクル事業も
0,3185,夢展望,4,26,100,http://www.dreamv.co.jp/,1998-05-14,2013-07-10,3,若い女性向け衣料品のネット通販を展開。自主企画に強み。健康コーポ傘下。\n１０〜２０代女性向けの衣料品ネット通販を展開。スマホに強み。業績悪化で健康コーポ傘下に
0,3186,ネクステージ,0,26,100,http://www.nextage.jp/,2002-08-01,2013-07-30,11,中古車販売大手。東海地盤から全国に展開。車種別専門店を出店。\n中古車販売の大手。東海発祥で全国店舗網を形成中。車種別の専門店展開、軽装備店舗に強み
0,3187,サンワカンパニー,4,26,100,http://www.sanwacompany.co.jp/,1979-08-22,2013-09-13,9,設計事務所や工務店、施主向けに建築資材のネット通販を手掛ける。\nキッチン、ドア、床など建築資材・設備のネット、カタログ通販。設計事務所や工務店が主顧客
0,3189,ＡＮＡＰ,2,26,100,http://www.anap.co.jp/,1992-09-22,2013-11-19,8,10～30歳代の女性向けカジュアル衣料・雑貨を製造販売。ネット通販の比率高い。\n１０〜３０代向けレディス衣料・雑貨の「ＡＮＡＰ」をＳＣ軸に展開。ＥＣ比率高い。収益は春夏偏重
0,3190,ホットマン,2,26,100,http://www.yg-hotman.com/,1975-01-17,2014-03-20,3,東北中心にイエローハットやTSUTAYAなどをFC展開。スタッドレスタイヤが収益の柱。\n宮城県地盤にイエローハット、ＴＳＵＴＡＹＡなどのＦＣを展開。収益柱はスタッドレスタイヤ
0,3191,ジョイフル本田,0,26,100,http://www.joyfulhonda.com/,1975-12-15,2014-04-18,620,ホームセンター大手。茨城・千葉を中心に関東で超大型店を展開。\nホームセンター大手。関東１都５県で５万平方メートルの超大型店を展開。大株主に三菱系ファンド
0,3192,白鳩,2,26,100,http://www.shirohato.co.jp/,1974-08-20,2014-04-23,8,レディスを中心とした下着のネット通販会社。仕入れ先は国内外の下着メーカー。\n女性中心の下着のネット通販会社。下着メーカーから仕入れ、自社サイトや「楽天市場」等で販売
0,3193,鳥貴族,1,26,100,http://www.torikizoku.co.jp/,1986-09-19,2014-07-10,7,全メニューが税抜き280円均一の焼き鳥チェーン「鳥貴族」を関西・首都圏で運営。\n焼き鳥屋「鳥貴族」の単一ブランドを東名阪を中心に展開。全メニューを税抜き２８０円で提供
0,3194,キリン堂ＨＤ,0,26,100,http://www.kirindo-hd.co.jp,2014-08-18,2014-08-18,2,近畿地盤の中堅ドラッグストア。関西地区で高シェア。郊外の大型店が主力。\n大阪地盤、関西地区で高シェアのドラッグストア。中国でも小売り展開。１４年８月に持株会社化
0,3195,ジェネレーションパス,4,26,100,http://www.genepa.com/,2002-01-18,2014-09-24,10,ネット通販サイト「リコメン堂」を運営。楽天やヤフーなどネット通販モールに店舗を展開。\nインテリアや家具、衣料品などのネット通販「リコメン堂」運営。独自のデータ分析手法に特徴
0,3196,ホットランド,0,26,100,http://www.hotland.co.jp/,1991-06-10,2014-09-30,12,たこ焼きチェーンの「築地銀だこ」やたい焼の「銀のあん」などを展開。\nたこ焼き「築地銀だこ」が主柱。たい焼き「銀のあん」も展開。台湾、香港などアジア軸に海外進出
0,3197,すかいらーく,0,26,100,http://www.skylark.co.jp/,2011-02-22,2014-10-09,12,ファミレス最大手。「ガスト」が主力。強みの郊外から都市部に進出へ。\nファミレス最大手。主力業態は「ガスト」。業績低迷で０６年にＭＢＯ実施。１４年１０月に再上場
0,3198,ＳＦＰダイニング,1,26,100,http://www.sfpdining.jp/,2010-11-17,2014-12-16,2,海鮮居酒屋「磯丸水産」が主力。手羽先店「鳥良」も展開。国産食材に強み。\n海鮮居酒屋「磯丸水産」が主力。手羽先唐揚げ「鳥良」も展開。クリエイト・レストランツＨＤ傘下
0,3199,綿半ホールディングス,1,26,100,http://watahan.co.jp/,1949-02-18,2014-12-24,3,長野地盤にホームセンターを展開。全店で食品扱う。建設業は屋根改修に強み。\n長野県地盤のＨＣと建設事業が２本柱。ＨＣ全店で食品、一部店で生鮮品も扱う。貿易事業併営
0,3221,ヨシックス,2,26,100,http://yossix.co.jp/,1985-04-01,2014-12-24,3,居酒屋チェーンを展開。二等地に低コストで出店。すし居酒屋など業態多数。\n名古屋地盤の居酒屋チェーン。すし居酒屋、均一低価格居酒屋など多業態、直営店中心で展開
0,3222,ＵＳＭＨ,0,26,100,http://www.usmh.co.jp/,2015-03-02,2015-03-02,2,イオン系で食品スーパー最大手。15年3月にマルエツ、カスミ、マックスバリュ関東が経営統合。\nイオン系。首都圏で展開する食品スーパー最大手。傘下にマルエツ、カスミ、マックスバリュ関東
0,3223,エスエルディー,2,26,100,http://www.sld-inc.com/,2004-01-06,2015-03-19,3,関東中心に和風創作料理店「KawaraCAFE&DINING」などを展開。\n関東中心に「ｋａｗａｒａＣＡＦＥ＆ＤＩＮＩＮＧ」など直営展開。音楽イベントも手掛ける
0,3224,ヒューマンウェブ,4,26,100,http://www.oysterbar.co.jp/,2000-04-03,2015-03-19,3,カキを主体とするオイスターバーの店舗経営やカキの卸売りを展開。\nカキの直営レストランを全国展開。卸売り兼営し、厚労省以上の衛生基準で養殖や加工にも進出
0,3313,ブックオフ,0,26,100,http://www.bookoff.co.jp/,1991-08-01,2004-03-16,3,中古書籍販売の最大手。衣料や家電など扱い拡大、総合リユース化目指す。\n中古本販売で首位。衣料や雑貨など商材増やし総合リユース化を志向。ヤフーと資本業務提携
0,3317,フライングガーデン,2,26,100,http://www.fgarden.co.jp/,1981-12-04,2004-03-16,3,北関東地盤の外食チェーン。郊外型のハンバーグレストラン「フライングガーデン」を展開。\n北関東地盤。郊外型レストラン「フライングガーデン」を直営展開。「爆弾ハンバーグ」が売り物
0,3318,メガネスーパー,2,26,100,http://www.meganesuper.co.jp/,1980-09-26,2004-03-24,4,眼鏡小売り大手。関東地盤に直営店を全国展開。投資ファンドの支援受ける。\n眼鏡小売りチェーン大手。直営方式。関東圏地盤に全国展開。投資ファンド支援の下で再建図る
0,3319,ＧＤＯ,0,26,100,http://www.golfdigest.co.jp/,2000-05-01,2004-04-01,12,ゴルフ専門サイトを運営。プレー予約や用品販売が収益の柱。出版社が出資。\n記事サイトで集客、ゴルフ場予約、同用品販売で稼ぐ。中古品売買も。同名ゴルフ出版社が出資
0,3325,ケンコーコム,4,26,100,http://www.kenko.com/,1994-11-08,2004-06-16,12,医薬品、日用品の通販サイトを運営。健康食品販売も。品揃えが豊富。\n医薬品、健康食品等のＥＣ「ケンコーコム」展開。１４年１月楽天から日用品特化型「楽天２４」譲受
0,3328,ＢＥＥＮＯＳ,4,26,100,http://beenos.com/,1999-11-25,2004-07-08,9,越境eコマース事業が主力。ネット宅配買い取りや海外発送代行なども展開。\n主力は越境ｅコマース事業。ネット宅配買い取りや海外でのインキュベーション事業も展開
0,3329,東和フードサービス,2,26,100,http://www.towafood-net.co.jp/,1999-05-01,2004-07-14,4,首都圏中心に外食チェーン、高級喫茶を展開。パスタの「ダッキーダック」が主力。\n椿屋をはじめとした高級喫茶、ダッキーダックが主力の外食チェーン。東京圏に直営出店
0,3331,雑貨屋ブルドッグ,2,26,100,http://www.z-bulldog.co.jp/,1982-12-15,2004-08-06,8,ファッション雑貨店をチェーン展開。若い女性が主要顧客。16年3月にアクサスと統合。\n若い女性向けファッション雑貨店展開。アクサスと１６年３月に経営統合、共同持株会社が上場へ
0,3333,あさひ,0,26,100,http://www.cb-asahi.jp/,1975-05-21,2004-08-12,220,自転車小売り大手。大型専門店を直営展開、ネット通販も。PB比率高い。\n大規模自転車専門店を直営中心に展開、ネット通販も。ＰＢ比率６割弱、中国、台湾へ生産委託
0,3341,日本調剤,0,26,100,http://www.nicho.co.jp/,1980-03-07,2004-09-17,3,調剤薬局大手。大病院前に積極出店。訪問サービスを強化。ジェネリック製造も。\n調剤２位、関東甲信越の門前薬局が地盤。駅前店や訪問サービス強化。後発医薬品製造を兼営 [企業特色]
0,3344,ワンダコーポ,2,26,100,http://www.wonder.co.jp/,1988-03-01,2004-10-13,2,CD、ゲームソフト、文具などを販売する郊外大型店「ワンダーグー」を全国展開。\nゲームソフトやＣＤ等を販売する「ＷｏｎｄｅｒＧＯＯ」を展開。スーパーのカスミグループ
0,3346,２１ＬＡＤＹ,10,26,0,http://www.21lady.com/,2000-03-07,2004-10-28,3,洋菓子「ヒロタ」が主力の投資・育成会社。輸入雑貨販売「イルムス」を育成へ。\n子会社化した洋菓子「ヒロタ」が中核。輸入雑貨販売「イルムス」を第２の柱に育成。経営再建中
0,3347,トラスト,1,26,100,http://www.trust-ltd.co.jp/,1988-12-27,2004-11-10,3,レンタカー事業とネット経由の海外個人向け中古車輸出が柱。VTホールディングス傘下。\nレンタカー事業が柱。ネット経由で海外個人向けに中古車輸出も。南アフリカでディーラー展開 [企業特色]
0,3349,コスモス薬品,0,26,100,http://www.cosmospc.co.jp/,1991-04-01,2004-11-11,5,九州地盤にドラッグストアを展開。郊外型大型店に特色。低価格戦略に強み。\n九州地盤のドラッグストア。食い合いおそれず小商圏に大型店多店舗展開。ディスカウント徹底
0,3352,バッファロー,2,26,100,http://www.buffalo.co.jp/,1983-04-28,2004-11-26,3,埼玉県内を中心にオートバックスのFC店を展開。カー用品販売、板金塗装など。\nカー用品のオートバックスＦＣ店を展開。埼玉が地盤。自社商標タイヤや板金塗装を強化中
0,3353,メディカル一光,2,26,100,http://www.m-ikkou.co.jp/,1985-04-17,2004-11-26,2,イオン系調剤薬局チェーン。三重地盤で関西に展開。介護付き有料老人ホームも柱。\n三重県地盤の調剤薬局チェーン。介護付き有料老人ホームが第２の柱。中京圏で後発医薬品卸も
0,3358,ワイエスフード,2,26,100,http://www.ys-food.jp/,1994-05-12,2005-02-09,3,九州地盤に豚骨ラーメン店を展開。「筑豊ラーメン山小屋」が主体。海外積極化。\n九州地盤で筑豊ラーメン「山小屋」「ばさらか」展開。直営からＦＣ主体に軸足。海外展開積極化
0,3361,トーエル,0,26,100,http://www.toell.co.jp/,1963-05-22,2005-02-25,4,神奈川地盤のLPG小売り中堅。配送密度高い。卸業も。ミネラル水事業育成。\n神奈川県地盤のＬＰガス事業者。高い配送密度が特色。飲料水育成し長野とハワイに生産拠点
0,3366,一六堂,0,26,100,http://www.ichirokudo.com/,1995-01-27,2005-04-06,2,居酒屋チェーン。「天地旬鮮八吉」と「五大陸」を展開。地方漁港のセリ参加権保有。\n都内中心に居酒屋を展開。主力は高価格帯の「天地旬鮮八吉」。地方漁港のセリ参加権保有が強み
0,3370,フジタコーポレーション,2,26,100,http://www.fujitacorp.co.jp/,1990-02-01,2005-04-20,3,大手外食・物販のFC店を運営。自社ブランドを構築、丼店「かつてん」展開。\n北海道地盤。ミスタードーナツなど飲食や物販フランチャイジー。自社業態丼店「かつてん」展開
0,3372,関門海,4,26,100,http://www.kanmonkai.co.jp/,1989-05-18,2005-06-02,3,フグ料理専門店をチェーン展開。格安店「玄品ふぐ」が主。独自の養殖に強み。\n格安フグ料理「玄品ふぐ」が主力でカニ料理店も。冬場に通期利益の大半稼ぐ。経営再建中
0,3375,ＺＯＡ,2,26,100,http://www.zoa.co.jp/,1984-04-27,2005-06-17,3,バイク用品販売併設のパソコン店を中部圏などで展開。ネット通販にも注力。\nバイク用品販売併設のＰＣ販売店を展開し、輸入ＰＢが得意。東海が地盤。ネット通販にも注力
0,3376,オンリー,1,26,100,http://www.only.co.jp/,1976-06-22,2005-07-08,8,ツープライス店を展開する紳士服製造・販売会社。オーダースーツも。丸井と提携。\n「ザ・スーパースーツストア」等ツープライス店軸に自社ブランド紳士服を販売。丸井と業務提携
0,3382,セブン＆アイ,0,26,100,http://www.7andi.com/,2005-09-01,2005-09-01,2,総合小売業で国内2位。金融が成長。傘下にセブンイレブン、ヨーカ堂など。\n国内２位の流通コングロマリット。セブン‐イレブンを核に複数事業を展開。金融が急成長
0,3385,薬王堂,0,26,100,http://www.yakuodo.co.jp/,1991-06-01,2005-09-15,2,岩手地盤の独立系ドラッグストア。東北5県に出店。食品、化粧品、衣料等展開。\n独立系ドラッグストア。食品、化粧品も展開。地盤の岩手に加え宮城、青森、秋田で集中出店
0,3387,クリレスＨＤ,0,26,100,http://www.createrestaurants.com/,1997-04-22,2005-09-28,2,外食チェーンを展開。駅ビル、SCなど立地特性に応じ業態を開発。居酒屋育成。\nＳＣ内にレストランやカフェ展開、立地ごとの業態開発に強み。居酒屋など郊外型店舗を育成中
0,3391,ツルハホールディングス,0,26,100,http://www.tsuruha-hd.co.jp/,1963-06-01,2005-11-16,515,ドラッグストア大手。北海道地盤に東日本に拡大。アジアに進出。M&A積極化。\nドラッグストア大手の一角。北海道から南下して勢力を東日本に拡大、レデイ薬局を子会社化
0,3395,サンマルク,0,26,100,http://www.saint-marc-hd.com/,1991-07-19,2006-01-01,3,外食チェーンを全国展開。直営の「サンマルクカフェ」が収益柱。「鎌倉パスタ」を育成中。\n直営「サンマルクカフェ」が収益源。同名レストランはＦＣ主力。「鎌倉パスタ」育成中。好財務
0,3396,フェリシモ,0,26,100,http://www.felissimo.co.jp/,2002-08-01,2006-02-08,2,カタログ通販大手。衣料品・生活関連品などの長期購入予約型システムに特色。\n通販で衣料品、住宅用品、美容関連などの生活関連品を扱う。中・長期購入予約型商品に特徴
0,3397,トリドール,0,26,100,http://www.toridoll.com/,1995-10-28,2006-02-15,3,家族向け飲食店を展開。焼鳥店発祥だが低価格うどん「丸亀製麺」にシフト。\n焼き鳥店発祥。低価格のセルフ式うどん「丸亀製麺」にシフト。中国など海外でも積極展開
