0,8165,千趣会,0,26,100,http://www.senshukai.co.jp/,1955-11-09,1984-05-08,12,カタログ・ネット通販大手。女性向け衣料・雑貨の「ベルメゾン」を展開。ブライダルも。\n「ベルメゾン」展開するカタログ、ネット主体の通販大手。頒布会、店舗に特徴。ブライダル事業も
0,8166,タカキュー,0,26,100,http://www.taka-q.com/,1950-06-30,1984-09-20,2,衣料品販売会社。紳士向けが主力。自社ブランド強化。イオンと提携。\n紳士衣料品主軸の企画・販売会社。イオンと提携。機能性・ファッション性高い商品の開発強化
0,8167,リテールパートナーズ,1,26,100,http://www.retailpartners.co.jp/,1954-03-12,1984-10-03,2,山口地盤の食品スーパー。マルミヤストアと経営統合。生鮮品に強み。地域密着。\n食品スーパー中堅。１５年７月に山口県地盤の丸久と大分県地盤のマルミヤストアが経営統合
0,8168,ケーヨー,0,26,100,http://www.keiyo.co.jp/,1952-05-31,1984-12-24,2,ホームセンター大手。DIY、家庭用品中心。関東軸に中部、関西へ展開。イオンと提携。\n関東地盤の大手ホームセンター。中部、関西も展開。ＤＩＹ、家庭用品中心。イオンと資本提携
0,8171,マックスバリュ中部,9,26,0,http://www.mv-chubu.co.jp/,1973-08-21,1987-11-06,2,イオン系食品スーパー。三重地盤から愛知や滋賀、岐阜にも進出。食育活動も。\nイオン系の食品スーパー。地盤の三重から愛知、滋賀、岐阜へ展開。名古屋の同業をＭ＆Ａで取得
0,8173,上新電機,0,26,1000,http://www.joshin.co.jp/,1950-02-02,1972-09-01,3,関西地盤の家電量販大手。郊外型店を展開。PC、玩具、ソフト専門店なども。\n関西地盤の家電量販大手。ＰＣや玩具、ソフトの専門店も展開。営業等でも地元色を全面訴求
0,8174,日本瓦斯,0,26,100,http://www.nichigas.co.jp/,1955-07-29,1973-02-01,3,LPG、都市ガスを展開。関東一円に供給。直販に特色。電力にも参入。\n関東地盤にＬＰガス、都市ガスを展開。直販に特色。Ｍ＆Ａ戦略で商圏拡大。電力にも参入
0,8175,ベスト電器,0,26,100,http://www.bestdenki.ne.jp/,1953-09-03,1973-09-01,2,九州地盤の家電量販店。全国展開から地盤回帰。ヤマダ電機傘下。\n九州発の家電量販。全国展開したが業績暗転、地盤回帰で経営再建。１２年からヤマダ電機傘下
0,8179,ロイヤルＨＤ,0,26,100,http://www.royal-holdings.co.jp/,1956-05-14,1978-08-01,12,外食老舗。「ロイヤルホスト」・「てんや」が主力。ホテル運営や機内食など多角化。\n外食老舗。「ロイヤルホスト」と天丼「てんや」が柱。空港など施設内食堂や機内食、ホテルも展開
0,8181,東天紅,0,26,1000,http://www.totenko.co.jp/,1948-09-01,1978-10-01,2,中華レストラン大手。「東天紅」を全国展開。宴会依存度大。披露宴事業も。\n中華レストラン「東天紅」を全国の都市部に展開。宴会依存度高い。新・上野本店で婚礼に注力
0,8182,いなげや,0,26,100,http://www.inageya.co.jp/,1948-05-20,1978-10-01,3,東京多摩地区地盤の食品スーパー中堅。イオンと提携。子会社にドラッグストアも。\n東京・多摩地盤の食品スーパー。ドラッグ子会社を持つ。高級スーパーも展開。イオンと提携
0,8184,島忠,0,26,100,http://www.shimachu.co.jp/,1947-03-01,1979-11-14,8,家具店とホームセンターを展開。埼玉地盤に関東・関西に展開。店舗大型化。\n埼玉地盤に関東、関西で家具店とホームセンター（ＨＣ）を展開。店舗大型化進む。無借金経営
0,8185,チヨダ,0,26,100,http://www.chiyodagrp.co.jp/,1948-06-04,1980-04-23,2,靴量販店大手。「東京靴流通センター」が主力。子会社でカジュアル衣料小売りも。\n靴量販店大手、主力は「東京靴流通センター」。子会社にカジュアル衣料販売「マックハウス」
0,8186,大塚家具,2,26,100,http://www.idc-otsuka.jp/company/,1969-03-01,1980-06-18,12,総合家具専門店大手。輸入品に強み。一族対立による経営混乱から収束。\n総合家具小売り大手。都市部展開。中高級品・輸入品に強み。独自の会員価格販売。一族で対立も
0,8190,ヤマナカ,9,26,0,http://www.super-yamanaka.co.jp/,1957-07-16,1981-02-16,320,愛知地盤のスーパー中堅。高級スーパーを積極展開。ディスカウント業態も。PB拡充。\n愛知地盤の中堅スーパー。高級業態、ディスカウント業態も展開。ＰＢ商品拡充で差別化図る
0,8194,ライフコーポレーション,0,26,100,http://www.lifecorp.jp/,1956-10-24,1982-10-01,2,食品スーパー大手。首都圏・近畿地方で積極的に展開。ネットスーパーを本格化。\n食品スーパー大手。近畿と首都圏を中心に集中展開。三菱商事の持分法会社。ニチリウグループ
0,8198,マックスバリュ東海,1,26,100,http://www.mv-tokai.com/,1962-06-20,2004-07-30,2,イオン系の食品スーパー。静岡県を中心に出店。ネットスーパーも展開。\n旧ヤオハンが経営破綻後、イオン傘下の食品スーパーとして再建。ディスカウント（ＤＳ）も展開
0,8200,リンガーハット,0,26,100,http://www.ringerhut.co.jp/,1964-03-07,1985-10-02,2,長崎ちゃんぽん「リンガーハット」が主力で全国にチェーン展開。とんかつ「浜勝」も。\n九州発祥。長崎ちゃんぽん「リンガーハット」と、とんかつ「浜勝」が軸。ハチバンと資本提携
0,8201,さが美,0,26,1000,http://www.sgm.co.jp/,1974-04-15,1985-10-28,220,ユニー系呉服専門チェーン。毛皮、宝飾品も。生活雑貨や帽子を育成、非呉服強化。\nユニー系呉服専門店チェーン。呉服低迷で再建中。雑貨、洋装・帽子など非呉服部門強化中
0,8202,ラオックス,1,26,1000,http://www.laox.co.jp/,1976-09-27,1985-12-04,12,中国蘇寧電器集団傘下の家電量販店。外国人観光客向け免税品販売が主力。\n０９年中国同業の蘇寧雲商傘下に。国内は中国人観光客への免税品販売が主。中国は家電店を展開
0,8203,ＭｒＭａｘ,0,26,100,http://www.mrmax.co.jp/,1950-12-08,1986-04-01,3,九州地盤の総合ディスカウント店。家電や日用品の他、生鮮食品や薬品なども。\nショッピングセンター入居の家電、日用品ディスカウントストア。生鮮食品や薬品も。九州地盤
0,8207,テンアライド,0,26,100,http://www.teng.co.jp/,1969-12-20,1986-11-12,3,居酒屋チェーン老舗。「天狗」を首都圏中心に直営展開。和食レストランなども。\nチェーン居酒屋の老舗。首都圏中心に「天狗」ブランドで居酒屋、和食レストランを直営展開
0,8208,エンチョー,2,26,1000,http://www.encho.co.jp/,1962-07-19,1986-11-21,3,静岡地盤のホームセンター大手。住宅関連が主体。専門店を強化。店舗大型化。\n静岡県地盤の住宅関連主体ＨＣ大手。中京、南関東も展開。専門店強化、店舗大型化に取り組む
0,8209,フレンドリー,1,26,1000,http://www.friendly-co.com/,1954-08-01,1986-11-04,3,近畿地盤の外食中堅。ファミレス「フレンドリー」、すし・炉端の「源ぺい」などを展開。\n近畿地盤にファミレスなど展開。地域経済活性化支援機構の下で事業再生中。８業態から集約へ
0,8214,ＡＯＫＩＨＤ,0,26,100,http://www.aoki-hd.co.jp/,1976-08-21,1987-04-08,3,紳士服専門大手。首都圏中心に展開。ネットカフェ・カラオケ・結婚式場など多角展開。\n紳士服専門店で業界２位。複合カフェやカラオケ、結婚式場「アニヴェルセル」等へも展開
0,8215,銀座山形屋,2,26,1000,http://www.ginyama.co.jp/,1946-11-14,1987-09-09,3,注文紳士服老舗。小売りと催事販売が柱。若者向けブランド強化、レディスも。\n注文紳士服の老舗大手、１９０７年創業。小売りと催事販売が柱。婦人服、若者向け強化中
0,8217,オークワ,0,26,1000,http://www.okuwa.net/,1969-02-21,1987-10-08,220,和歌山地盤のスーパー。近畿・中部に展開。食品の製造物流に強み。ニチウリ系。\n和歌山地盤で近畿、中部圏に展開。スーパーセンター（ＳｕＣ）も運営。ニチリウグループ
0,8218,コメリ,0,26,100,http://www.komeri.bit.or.jp/,1962-07-02,1987-10-28,3,ホームセンター大手。園芸・金物品が主体。小型店と大型店組み合わせ全国展開。\n新潟発祥の大手ホームセンター（ＨＣ）。小型店と大型店を組み合わせた集中出店で全国展開
0,8219,青山商事,0,26,100,http://www.aoyama-syouji.co.jp/,1964-05-06,1987-11-09,3,紳士服専門最大手。郊外や都心で出店。セレクトショップやカジュアル展開も。\n紳士服業界首位、郊外型紳士服専門店チェーンの草分け。カジュアルやセレクトショップも展開
0,8227,しまむら,0,26,100,http://www.shimamura.gr.jp/,1953-05-07,1988-12-23,220,衣料品小売り。低価格のファッション衣料店を全国展開。少量多品種型。\n低価格の実用・ファッション衣料。少量多品種。店舗標準化でコスト低減。郊外から都市部進出
0,8230,はせがわ,0,26,100,http://www.hasegawa.jp/,1966-12-28,1988-11-10,3,仏壇仏具専門店最大手。墓石や屋内墓苑販売を強化。寺社修復なども。\n仏壇仏具の小売専門店で業界首位。葬儀社との提携販売も。墓石に加え屋内墓苑の販売を積極化
0,8233,高島屋,0,26,1000,http://www.takashimaya.co.jp/,1919-08-20,1949-05-01,2,老舗百貨店。東京、大阪等全国展開。シンガポールにも。不動産開発に定評。\n東京、大阪等全国展開する老舗百貨店。シンガポール店とＳＣ子会社・東神開発の寄与大きい
0,8237,松屋,0,26,100,http://www.matsuya.com/,1919-03-01,1961-10-01,2,名門百貨店。銀座・浅草の２店舗体制。子会社で飲食店も運営。\n呉服店発祥の名門百貨店。銀座本店と浅草店の２店体制。独立路線維持。子会社で飲食店運営も
0,8242,Ｈ２Ｏリテイ,0,26,100,http://www.h2o-retailing.co.jp/,1947-03-07,1949-05-01,3,阪急百貨店と阪神百貨店が統合。スーパーのオアシス、イズミヤも。高島屋と提携。\n０７年阪急、阪神百貨店が統合。食品スーパーのオアシス、総合スーパーのイズミヤ等も展開
0,8244,近鉄百貨店,0,26,1000,http://www.d-kintetsu.co.jp/,1934-09-29,1949-07-01,2,近鉄グループで沿線に店舗展開。あべのハルカス本店が14年３月全館開業。\n近鉄グループ。大阪南部、奈良が地盤。ハルカス先行開業した阿倍野本店が１４年３月に全館開業
0,8245,丸栄,0,26,1000,http://www.maruei.ne.jp/,1943-08-27,1949-05-16,2,名古屋の老舗百貨店。地域密着型で営業は栄本店のみ。興和傘下で再建。\n名古屋の百貨店「４Ｍ」の一角。医薬品など手掛ける興和傘下で再建目指す。店舗は栄本店のみ
0,8247,大和,1,26,1000,http://www.daiwa-dp.co.jp/,1943-12-21,1949-07-04,2,北陸地盤の百貨店老舗。金沢に旗艦店舗。子会社に勁草書房やホテルなど。\n１９２３年創設の老舗百貨店。金沢の香林坊に旗艦店、富山に２店。子会社にホテルや勁草書房
0,8248,ニッセンＨＤ,0,26,100,http://www.nissen.info/,1970-04-10,1988-10-03,1220,通販大手。衣料品、雑貨などをカタログとネットで通販。親会社はセブン＆アイHD。\nカタログ通販大手。ネット通販やギフト店「シャディ」も展開。１４年セブン＆アイグループ入り
0,8251,パルコ,0,26,100,http://www.parco.co.jp/,1953-02-13,1963-07-25,2,ファッションビル経営の先駆け。劇場なども展開。森トラストからＪフロント傘下に。\nファッションビル経営の先駆でデベロッパー事業主力。劇場など兼営。１２年、Ｊフロント傘下に
0,8252,丸井グループ,0,26,100,http://www.0101maruigroup.co.jp/,1937-03-30,1963-04-01,3,首都圏の若者向け百貨店。自社カードの割賦販売に強み。手数料が収益源。\n百貨店は消化仕入れ取引をＳＣ化へ切り替え中。自社カードによる割賦販売・手数料収入が柱
0,8254,さいか屋,1,26,1000,http://www.saikaya.co.jp/,1950-11-18,1964-08-01,2,神奈川地盤の百貨店老舗。町田店を売却もリースバックで営業続ける。\n神奈川の老舗百貨店。１５年１月売却の町田店は、リースバックで営業継続。外商を強化中
0,8255,アクシアル,0,26,100,http://www.axial-r.com,1967-08-01,1988-10-25,3,新潟地盤の食品スーパー。北関東にも展開。袋詰めなど独自サービスに特色。\n新潟地盤の食品スーパー原信とナルスが統合して発足。１３年１０月に群馬地盤フレッセイと合併
0,8257,山陽百貨店,2,26,100,http://www.sanyo-dp.co.jp/,1952-02-01,1970-04-27,2,山陽電鉄系の百貨店で、姫路駅ターミナルの本店のみ。サテライトショップを展開。\n山陽電鉄系。百貨店は姫路駅ターミナルの本店単店舗、サテライトショップ６店舗等も展開
0,8260,井筒屋,0,26,1000,http://www.izutsuya.co.jp/,1935-07-30,1961-12-01,2,北九州地盤の百貨店老舗。友の会事業も展開。財務体質改善を推進。\n北九州が地盤の老舗百貨店。リストラ一段落、期間利益の積み上げで財務体質の改善を進める
0,8267,イオン,0,26,100,http://www.aeon.info/,1926-09-21,1974-09-01,2,総合小売大手。国内流通で首位。傘下に不動産・金融など。ダイエーを買収。\n国内流通首位。ＧＭＳ、ＳＭ、専門店、不動産、金融等展開。郊外ＳＣ、Ｍ＆Ａで成長。ダイエー買収
0,8270,ユニーＧＨＤ,0,26,100,http://www.unygroup-hds.com/,1950-03-13,1976-12-01,2,中部地盤の総合スーパー大手。傘下に婦人服・コンビニ・カード会社など。\n愛知地盤の総合スーパー大手。「アピタ」「ピアゴ」展開。コンビニも。ファミマと統合へ協議中
0,8273,イズミ,0,26,100,http://www.izumi.co.jp/,1961-10-27,1978-10-01,2,山陽地方の有力スーパー。九州、四国にも展開。大型SCを積極出店。ニチウリG。\n山陽地方地盤の有力スーパー。九州、四国へも進出。ニチリウグループの会員。子会社で多角化
0,8274,東武ストア,0,26,1000,http://www.tobustore.co.jp/,1960-12-01,1979-09-01,2,東武鉄道系スーパー中堅。沿線に展開。深夜営業強化。ファストフードや警備業も。\n東京、埼玉、千葉の東武沿線中心に展開。丸紅が筆頭株主。東武鉄道も出資。深夜営業を強化
0,8276,平和堂,0,26,100,http://www.heiwado.jp/,1957-06-18,1981-10-01,220,滋賀地盤のスーパー。県内で圧倒的シェア。大型店が主力。中国に百貨店進出。\n滋賀県で圧倒的シェアのスーパー。東海や北陸に出店、中国に百貨店進出。ニチリウグループ
0,8278,フジ,0,26,100,http://www.the-fuji.com/,1967-09-12,1987-10-01,2,愛媛地盤で四国最大のスーパー。中国地方にも展開。大型ＳＣの開発推進。\n四国最大のチェーンストア。愛媛を地盤に広島など中国地区へも展開。ＳＣ形式の出店が中心
0,8279,ヤオコー,0,26,100,http://www.yaoko-net.com/,1974-03-05,1988-02-05,3,埼玉地盤の食品スーパー中堅。提案型売り場作りに定評。神奈川にも展開。\n埼玉県中心に食品スーパーを展開。独立系。提案型売り場作りに定評。ライフとＰＢ共同開発
0,8281,ゼビオホールディングス,0,26,100,http://www.xebio.co.jp,1973-07-05,1988-04-11,3,スポーツ用品専門店を東日本中心に展開。「ゼビオ」と「ヴィクトリア」が主柱。\nスポーツ用品販売大手。大型店のスーパースポーツゼビオ、ヴィクトリアが柱。ゴルフ専門店も
0,8282,ケーズホールディングス,0,26,100,http://www.ksdenki.com/,1973-09-29,1988-04-14,3,北関東地盤の家電量販大手。デンコードーなど買収し全国展開。M&A積極化。\n北関東地盤の家電量販。デンコードーなど買収し全国区へ拡大。現金値引きと郊外出店に特徴
0,8287,マックスバリュ西日本,1,26,100,http://www.maxvalu.co.jp/,1982-12-06,1988-09-14,2,兵庫地盤のイオン系食品スーパー。中国四国地方へエリア拡大。ディスカウント店も。\nイオン系食品スーパー。発祥の姫路から山陽、四国へ拡大。ディスカウント店（ＤＳ）も展開
0,8289,Ｏｌｙｍｐｉｃグループ,0,26,100,http://www.olympic-corp.co.jp/,1973-02-22,1988-10-05,2,独立系の小売業中堅。首都圏中心に食品スーパーやディスカウント店を展開。\n独立系。首都圏地盤に食品スーパーや大型ホームセンター、専門店など業態別に子会社化し展開
0,8291,日産東ＨＤ,0,26,100,http://www.nissan-tokyo-hd.co.jp/,1942-11-16,1957-10-01,3,日産系ディーラー最大手。傘下に東京日産など３販社。中古車や車検事業も。\n日産系最大手ディーラー。東京の個人・小口法人販売を集約し発足、傘下に東京日産など３販社
0,8293,ＡＴグループ,9,26,0,http://www.at-group.jp/,1942-11-02,1961-10-01,3,中部最大のトヨタ系ディーラー。スズキ車も扱う。中古車や住宅販売なども。\nトヨタの有力ディーラーで愛知トヨタが核。ネッツやレクサス店も展開。スズキ車も取り扱う
0,8298,ファミリー,2,26,100,http://www.cardealerfamily.co.jp/,1973-07-17,1988-02-05,3,千葉地盤の独立系輸入車販売。VW等10ブランドを扱う。太陽光発電に参入。\n千葉県地盤の独立系輸入車ディーラー。ＶＷなど１０ブランドを販売。太陽光発電事業に参入
0,9627,アインファーマシーズ,0,26,100,http://www.ainj.co.jp/,1969-08-02,1994-03-18,4,調剤薬局首位。北海道地盤から全国展開。丸紅、セブン＆アイと提携。\n門前薬局首位。大型店得意。都心で女性向けドラッグストアも。セブン＆アイと資本・業務提携
0,9819,スーパー大栄,11,26,0,http://www.superdaiei.com/,1971-02-15,1991-03-07,2,北九州地盤の食品スーパー。生鮮食品が主力。日用雑貨や衣料品も扱う。\n北九州地盤のスーパー。ディスカウント店や外食店など展開。ＴＯＢでイズミの子会社に
0,9823,マミーマート,2,26,100,http://www.mammymart.co.jp/,1965-10-11,1991-05-23,9,埼玉地盤の食品スーパー。「マミーマート」が主力。低価格業態や生鮮強化店も。\n埼玉地盤の食品スーパー。主力「マミーマート」に加え生鮮強化店、ディスカウント店も展開
0,9826,ＪＥＵＧＩＡ,1,26,1000,http://www.jeugia.co.jp/,1952-05-26,1991-07-17,3,ヤマハ系の音楽ソフト、楽器販売中堅。成人向け音楽教室運営を強化。\nヤマハ系の楽器販売から出発。京都地盤のＡＶソフト・楽器販売の中堅。カルチャー教室強化
0,9828,元気寿司,0,26,100,http://www.genkisushi.co.jp/,1979-07-26,1991-08-30,3,郊外型回転ずし大手。「元気寿司」が主力。カッパHDと経営統合前提に提携。\nすし業態「魚べい」が主柱。中国や米国でも展開。米穀卸・神明がＴＯＢで１５年６月に子会社化
0,9829,ながの東急百貨店,2,26,1000,http://www.nagano-tokyu.co.jp/,1958-11-10,1991-08-29,1,東急百貨店グループ。主力の長野店は県内最大級。\n東急百貨店グループ。長野店は地域唯一の百貨店で県下最大。主力店舗は長野店と北長野ＳＣ
0,9831,ヤマダ電機,0,26,100,http://www.yamada-denki.jp/,1983-09-01,1989-03-23,3,家電量販店最大手。大型店展開で急成長。北関東地盤に全国店舗網展開。\n家電量販店最大手。売り場面積３０００平方メートル超の郊外店で急成長。スマートハウス事業を育成中
0,9835,ジュンテンドー,1,26,1000,http://www.juntendo.co.jp/,1977-11-18,1989-03-23,2,ホームセンター中堅。中国地方で首位、近畿にも。書店や薬局も展開。\n中国地方トップシェアのホームセンター。近畿にも店舗。農業関連品に特化した小型店も展開
0,9842,アークランドサカモト,0,26,100,http://www.arcland.co.jp/,1970-07-01,1989-09-21,220,ホームセンター中堅。「ムサシ」を展開。超巨大店舗に特色。外食店も。\n新潟地盤にホームセンター、ＤＩＹ重視の巨大店「ムサシ」を展開。上場子会社で外食「かつや」
0,9843,ニトリホールディングス,0,26,100,http://www.nitorihd.co.jp/,1972-03-03,1989-09-27,220,家具・インテリア販売チェーン店。開発輸入品が主力。全国に積極展開。\n全国トップの家具・インテリア製造小売りチェーン。開発輸入品が８割。海外に自社工場も
0,9846,天満屋ストア,1,26,100,http://www.tenmaya-store.co.jp/,1969-04-01,1989-10-26,2,岡山地盤のスーパー。老舗百貨店天満屋グループ。広島、香川にも展開。\n老舗百貨店天満屋グループのスーパー。岡山、広島、香川に展開。イトーヨーカ堂の持分会社に
0,9850,グルメ杵屋,0,26,1000,http://www.gourmet-kineya.co.jp/,1967-03-18,1989-11-16,3,多業態店舗を展開する外食大手。うどん「杵屋」が主力。ケータリングも。\n主力うどん「杵屋」、そば「そじ坊」のほかに洋食店など多業態展開。機内食製造、ケータリングも
0,9853,銀座ルノアール,2,26,100,http://www.ginza-renoir.co.jp/,1979-05-04,1989-11-28,3,首都圏に喫茶店をチェーン展開。カフェ業態も。改装を積極促進。\n「喫茶室ルノアール」展開。フルサービスに特徴。貸し会議室も。１３年初、キーコーヒーと資本提携
0,9854,愛眼,0,26,100,http://www.aigan.co.jp/,1961-01-11,1989-11-29,3,メガネの卸・小売大手。関西地盤に直営、ＦＣ方式で全国展開。\n眼鏡の卸・小売り専業大手。関西圏地盤に全国展開。ショッピングセンター内の立地が６割強
0,9855,くろがねや,1,26,100,http://www.kuroganeya.co.jp/,1966-11-25,1989-12-12,515,山梨地盤のホームセンター中堅。神奈川、東京に展開。カーマと提携。\n甲府拠点の中堅ホームセンター（ＨＣ）、神奈川、東京にも。中部の同業カーマと業務・資本提携
0,9856,ケーユーＨＤ,0,26,100,http://www.ku-hd.com/,1972-10-26,1989-12-13,3,中古車販売大手。関東で店舗網拡大。輸入車に注力。自動車保険強化。\n中古車販売大手。ベンツ、ＢＭＷの正規ディーラーも。関東で店舗網拡大。自動車保険にも注力
0,9861,吉野家ホールディングス,0,26,100,http://www.yoshinoya-holdings.com/,1958-12-27,1990-01-31,2,牛丼屋の老舗。収益源の「吉野家」を全国展開。「京樽」など多角化。\n牛丼屋の老舗、国内２位。収益源の「吉野家」を直営軸に全国展開。すし、ステーキ、うどん等も
0,9866,マルキョウ,11,26,0,http://www.marukyo-web.co.jp/,1964-12-03,1990-04-26,9,福岡地盤の食品スーパー。一部店舗で医薬品も販売。北九州に広域店舗網。\n福岡地盤の食品スーパー。九州北部に広域展開。西鉄と資本提携し、傘下ストアと協業進める
0,9870,ハナテン,1,26,100,http://www.8710.co.jp/,1966-03-11,1990-07-11,9,関西地盤の中古車販売老舗。オークションも主催。店舗大型化に注力。\n中古車販売老舗。０５年に西日本地盤のビッグモーターの傘下に。北陸など未開拓地域の出店強化
0,9873,日本ＫＦＣ,1,26,100,http://japan.kfc.co.jp/,1970-07-04,1990-08-21,3,ファーストフード大手。フライドチキンが収益源。宅配ピザを拡大へ。\nＦＣ軸に「ケンタッキーフライドチキン」展開。宅配ピザも。三菱商事系。１４年４月に持株会社化
0,9876,コックス,2,26,100,http://www.cox-online.co.jp/,1973-05-16,1990-08-24,2,イオン系のカジュアル衣料専門店。ＳＣ軸に全国展開。靴販売も。\nイオン系カジュアル衣料専門店。ＳＣ内への出店が中心。ブルーグラスと合併。メンズ強化中
0,9878,セキド,1,26,1000,http://www.sekido.com/,1963-02-11,1990-08-28,320,ファッション専門店を展開。家電は店舗販売から撤退も、外商・ネット通販は継続。\nブランド品店「ラブラブ」のファッション事業が柱。祖業の家電量販店は撤退。ネット通販育成
0,9887,松屋フーズ,0,26,100,http://www.matsuyafoods.co.jp/,1980-01-16,1990-10-12,3,牛丼チェーン店。首都圏中心に全国展開本格化。とんかつ店も出店。\n「牛めし」中心の定食店を展開。東名阪に加え、全国規模の出店に本腰。とんかつ業態を育成中
