0,3686,ディー・エル・イー,4,24,100,http://www.dle.jp/jp/,2003-10-01,2014-03-26,6,独自キャラの著作権ビジネスを手掛ける。「秘密結社鷹の爪」が人気。アニメ制作も。\n「秘密結社鷹の爪」等キャラクターを中心とした著作権ビジネスを展開、映像の企画、制作も
0,3687,フィックスターズ,4,24,100,http://www.fixstars.com/ja/,2002-10-25,2014-04-23,9,ソフト開発会社。システムの高速化で業務支援。関連ハードウエア販売も。\nマルチコアプロセッサの性能を向上させるソフトウエア開発が主力。関連ハードウエア販売も
0,3688,ボヤージュ,0,24,100,http://voyagegroup.com/,1999-10-08,2014-07-02,9,ポイントを活用した販促支援サイトを展開。メディア向け広告配信プラットフォーム運営も。\nメディア向け広告配信プラットフォームの企画・運営で国内唯一。販売促進支援サイトも展開
0,3689,イグニス,4,24,100,http://1923.co.jp/,2010-05-31,2014-07-15,9,スマホ向けアプリを企画・制作・運営。無料アプリ「だーぱんコレクション」が人気。\nスマホ向けアプリを企画、制作、運営。無料アプリ、有料の漫画、ソーシャルゲームなど配信
0,3690,ロックオン,4,24,100,http://www.lockon.co.jp/,2003-07-11,2014-09-17,9,ネット広告の効果分析サービスなど運用をサポート。ECサイト構築も。海外開拓へ。\nインターネット広告の運用サポートサービスを提供。ＥＣサイト構築関連も。海外展開を模索
0,3691,リアルワールド,4,24,100,http://realworld.co.jp/,2005-07-29,2014-09-18,9,クラウドソーシング大手。ネットを活用し仕事を仲介。ポイント付与サイトなども運営。\nポイント付与サイト「Ｇｅｎｄａｍａ」等運営。サイト広告が収益柱。ネット活用の仕事仲介も
0,3692,ＦＦＲＩ,4,24,100,http://www.ffri.jp/,2007-07-03,2014-09-30,3,サイバーセキュリティ製品の研究開発や販売を手掛ける。ウイルス検知技術に強み。\nネット上で攻撃相手が明確な標的型攻撃の対策に特化。独立系で技術に強み。業績は下期偏重
0,3694,オプティム,4,24,100,http://www.optim.co.jp/,2000-06-08,2014-10-22,3,情報端末管理ソフトをクラウドで提供。遠隔操作のソフトに強み。保有特許多数。\n情報端末の管理ソフトをクラウドで提供。ライセンスやカスタマイズが収益源。保有特許豊富
0,3695,ＧＭＯリサーチ,4,24,100,http://www.gmo-research.jp/,2002-04-01,2014-10-21,12,GMOの子会社でネット調査の業務支援事業を手掛ける。アジアなど海外展開も。\nＧＭＯグループのネット調査会社。調査会社向けのシステム提供。中国、アジアなど海外展開も
0,3696,セレス,4,24,100,http://ceres-inc.jp/,2005-01-28,2014-10-22,12,ポイントサイト「モッピー」「モバトク」などスマホ向け広告サイトを運営。アルバイト求人サイトも。\n「モッピー」「モバトク」などスマホ向けポイントサイトを運営。求人メディアも。広告収入が柱
0,3697,ＳＨＩＦＴ,4,24,100,http://www.shiftinc.jp/,2005-09-07,2014-11-13,8,ソフトウエアのテスト事業が主力。ソフトの品質保証や関連コンサルも。組織力に強み。\nソフトウエアテスト事業が主力。ソフトウエアの品質保証も行い、関連のコンサルや研修も
0,3698,ＣＲＩ・ミドルウェア,4,24,100,http://www.cri-mw.co.jp/,2001-08-01,2014-11-27,9,映像・音声に特化したミドルウェアに関する許諾事業を展開。ゲーム開発などに。\nゲーム開発や遊技機向けミドルウエアが主力。ソフト使用許諾料によるストック型事業モデル
0,3710,ジョルダン,2,24,100,http://www.jorudan.co.jp/,1979-12-03,2003-04-16,9,鉄道経路探索ソフトの開発・販売が主体。動画配信や旅行販売なども展開。\n目的地までの経路探索ソフト「乗換案内」の開発販売が主軸。旅行販売や動画配信事業も展開
0,3711,創通,2,24,100,http://www.sotsu-co.jp/,1965-10-01,2003-04-25,8,テレビアニメの企画・制作。版権事業と両輪。「ガンダム」が収益柱。広告代理店も。\nアニメ番組の企画・制作と版権が２本柱。「ガンダム」が収益基盤。プロ球団の版権契約代行も
0,3712,情報企画,1,24,100,http://www.jyohokikaku.co.jp/,1986-10-01,2003-05-30,9,金融機関向け業務支援ソフトのパッケージを開発・販売。事業会社向けを開拓。\n信金など金融機関対象の業務支援パッケージを開発、販売。事業会社向けにも進出意欲が強い
0,3719,ジェクシード,2,24,100,http://www.gexeed.co.jp/,1964-10-06,2003-09-17,12,ERPソフトコンサル会社。人事・会計に特化。IPOや事業再生支援も。投資事業撤退。\n人事・会計に特化したＥＲＰコンサル企業。投資事業撤退、本業回帰で再建中。教育事業に注力
0,3723,日本ファルコム,4,24,100,http://www.falcom.co.jp/,2001-11-01,2003-12-02,9,プレステ用ゲームソフトの開発が主力。RPG系に強み。アプリなどのライセンス事業も。\nプレステ用ゲームソフトの企画・開発主力、ロールプレイング系得意。アプリ等のライセンスも
0,3724,ベリサーブ,0,24,100,http://www.veriserve.co.jp/,2001-07-24,2003-12-03,3,SCSKグループのIT製品検証会社。デジタル家電やITS等の互換性や動作をテスト。\nＳＣＳＫグループ。携帯、デジタル家電、高度道路交通システム（ＩＴＳ）のソフト検証で先駆的
0,3727,アプリックス,4,24,100,http://www.aplix-ip.com/,1986-02-22,2003-12-17,12,ソフトウェア基盤技術事業は縮小。MtoM(機器間無線通信)を強化。コミック事業も。\nソフトウエア基盤技術からＭｔｏＭ（機器間無線通信）にシフトし経営再建中。コミック事業も
0,3733,ソフトウェア・サービス,2,24,100,http://www.softs.co.jp/,1969-04-22,2004-02-20,10,医療機関向けに電子カルテや情報伝達システムを開発。保守サービスなども。\n病院向けに情報伝達システム、電子カルテを開発。ハードウエアの販売から保守サービスも
0,3734,インテア,4,24,100,http://www.inteahd.co.jp/,2000-03-09,2004-03-08,3,ITインフラから完全撤退、コンテンツ配信事業に転換。スマホ向け電子書籍など。\n創業のＩＴインフラ事業から完全撤退。スマホ向け電子書籍などコンテンツ配信事業に転換
0,3738,ティーガイア,0,24,100,http://www.t-gaia.co.jp/,1992-02-20,2004-04-07,3,携帯販売代理店最大手。テレパークとMSコミュニケーションズが統合。光回線販売も。\n携帯販売代理店最大手。０８年に大手２社が合併。光回線販売や決済サービスも。中国市場強化
0,3739,コムシード,10,24,0,http://www.commseed.net/,1991-12-13,2004-05-20,3,パチンコ関連のモバイル向けコンテンツに特化。会員料が収益源。オンラインゲームから撤退。\nパチンコ関連の携帯電話コンテンツなどモバイル事業に特化。オンラインゲームからは撤退
0,3741,セック,2,24,100,http://www.sec.co.jp/,1970-05-28,2004-06-10,3,システム開発会社。リアルタイムソフトウエア技術に強み。携帯の通信混雑回避など。\nリアルタイムソフトウエア技術に強み。携帯電話向けや防衛分野、ロボットなどで開発も
0,3742,ＩＴｂｏｏｋ,4,24,100,http://www.itbook.co.jp/,1990-06-06,2004-07-01,3,官公庁向け中心のITコンサル。独立系。業務・システムの最適化を提案。\n官公庁向け主体のＩＴコンサル。業務最適化・情報システム効率化を戦略提案。収益は下期偏重
0,3744,サイオステクノロジー,1,24,100,http://www.sios.com/,1997-05-23,2004-08-05,12,オープンソースやクラウド製品の開発・販売。Linux、Javaを使ったSIに強み。\nオープンソースやクラウド製品を開発・販売。システム障害回避ソフトが柱。大塚商会と親密
0,3747,インタートレード,1,24,100,http://www.itrade.co.jp/,1999-01-25,2004-09-16,9,証券向けシステムの開発・販売。ディーリングシステムなど主力。一般法人向けに進出。\n証券ディーリングやＦＸ取引システムの開発・保守が主力。一般法人向けシステムへも進出
0,3750,セブンシーズ,1,24,100,http://www.sshd.co.jp/,2004-10-01,2004-10-01,3,メディア、カード決済システム、債権回収業が３本柱。マーケティング事業も展開。\nメディア（広告と物販）、カード決済システム、新規のサービサー（債権回収業）が３本柱
0,3751,日本アジアグループ,0,24,100,http://www.japanasiagroup.jp/,1988-03-11,2004-10-08,3,太陽光、測量、不動産、金融の4事業が主力。国際航業ＨＤを完全子会社化。\n測量、不動産、金融が３本柱。太陽光発電育成中。主要子会社の国際航業ＨＤを１２年完全子会社化
0,3753,フライト,1,24,100,http://www.flight-hd.co.jp/,1988-04-06,2004-11-01,3,携帯端末利用の電子決済端末が主力。決済アプリサービス展開。ITコンサル・開発も。\nＩＴコンサル・開発手掛ける。モバイル型電子決済端末や決済アプリサービスなどを展開
0,3754,エキサイト,2,24,100,http://www.excite.co.jp/,1997-08-04,2004-11-02,3,ポータルサイトを運営。広告・コンテンツが両輪。20-30代前半向けに照準。伊藤忠系。\nインターネットポータル。顧客の女性比率高い。広告とコンテンツが２本柱。伊藤忠商事傘下
0,3756,豆蔵ホールディングス,0,24,100,http://www.mamezou-hd.com/,1999-11-11,2004-11-09,3,情報化コンサルが主力。企業に技術者派遣。買収で半導体装置保守に参入。\nシステム構築コンサル主力。開発支援、技術者研修も。ＪＭテクノ買収し半導体装置保守へ進出
0,3758,アエリア,2,24,100,http://www.aeria.jp/,2002-10-30,2004-12-15,12,PCオンラインゲームは市場縮小でスマホゲームにシフト中。家庭用ゲームやシステム開発も。\nＰＣオンラインゲーム市場縮小で、スマホゲームに展開するが先行投資段階。事業売却繰り返す
0,3760,ケイブ,2,24,100,http://www.cave.co.jp/,1994-06-15,2004-12-24,5,ソーシャルゲームが主力。PCオンラインゲームや業務用機開発も。グリーと提携解消。\nソーシャルゲームを柱にＰＣオンライン・家庭用ゲームも展開。グリーとの資本業務提携は解消
0,3762,テクマトリックス,0,24,100,http://www.techmatrix.co.jp/,1984-08-30,2005-02-18,3,情報インフラ構築、アプリ開発が主力。独自の医療情報クラウドサービスなどに強み。\n情報インフラ構築とアプリ開発が柱。医療、コールセンターなどクラウドに実績。楽天が大株主 [企業特色]
0,3763,プロシップ,2,24,100,http://www.proship.co.jp/,1969-04-09,2005-03-01,3,会計パッケージシステムの開発・販売が主力。固定資産・リース資産の管理などに強み。\n会計パッケージがメイン、特に固定資産管理、リース資産の管理などに強み。独立系。好財務
0,3765,ガンホー,0,24,100,http://www.gungho.co.jp/,1998-07-01,2005-03-09,12,スマホゲーム最大手。「パズル&ドラゴンズ」が大ヒット、収益の柱に。家庭用ゲームも。\nスマホゲーム「パズル＆ドラゴンズ」が収益柱、家庭用ゲームも展開。ソフトバンクの持分会社
0,3766,システムズ・デザイン,2,24,100,http://www.sdcj.co.jp/,1967-03-24,2005-03-09,3,システム開発、データ入力などアウトソーシング、会計ソフトのプレス発送の3事業を展開。\nＳＩとデータ入力、会計ソフトのプレス発送が柱。会計ソフトのＰＣＡ創業者一族が筆頭株主
0,3768,リスクモンスター,2,24,100,http://www.riskmonster.co.jp/,2000-09-19,2005-03-23,3,ネットで審査・与信管理サービスを提供。東京商工リサーチ企業情報を活用。\n東京商工リサーチ企業情報活用しネットで審査、与信管理サービスを提供。配当性向２０％以上
0,3769,ＧＭＯ－ＰＧ,0,24,100,http://corp.gmo-pg.com/,1995-03-08,2005-04-04,9,GMO系のカード決済代行会社。ECサイト向けに与信処理を代行。海外展開開始。\n消費者向けＥＣ（電子商取引）業者に決済処理サービス提供。ＧＭＯ子会社。海外展開も開始
0,3770,ザッパラス,0,24,100,http://www.zappallas.com/,2000-03-27,2005-05-27,4,携帯向けにコンテンツ配信。占いが主力。女性に強み。会員向けに物販も展開。\nモバイル端末向けコンテンツ配信。占いが主力で２０〜３４歳女性に強み。占い事業に経営資源集中
0,3771,システムリサーチ,2,24,100,http://www.sr-net.co.jp/,1981-03-26,2005-06-13,3,情報システム構築と保守・運用。自動車・機械・鉄鋼などに強み。トヨタ向け4割。\n製造業を中心とした企業向け情報システム構築と保守・運用。トヨタグループ向けが４割超
0,3772,ウェルス・マネジメント,4,24,100,http://www.wealth-mngt.com/,1999-12-06,2005-06-07,3,アセットマネジメント事業を展開。新聞・出版や広告・IRからは撤退。\nあかつきＦＧグループ。不動産ファンド活用し、ホテル事業に経営資源を集中化。新聞事業撤退
0,3773,アドバンスト・メディア,4,24,100,http://www.advanced-media.co.jp/,1997-12-10,2005-06-27,3,音声認識技術を活かした各種ソフトを開発。文字起こしサービスに参入。\n音声を文字変換する独自技術核にした各種業務用ソフト開発が柱。文字起こしサービスに参入
0,3774,ＩＩＪ,0,24,100,http://www.iij.ad.jp/,1992-12-03,2005-12-02,3,NTT系のネット接続サービス。法人向け主力。セキュリティー対策強化。クラウド事業も。\nネット接続の草分け。法人向け主体。システム構築、クラウド、ＭＶＮＯ事業も。ＮＴＴ系列
0,3775,ガイアックス,10,24,0,http://www.gaiax.co.jp/,1999-05-01,2005-07-12,12,ソーシャルゲームの問い合わせ対応代行、SNS運営支援が主力。ネット掲示板監視も。\nソーシャルゲームの問い合わせ対応代行とＳＮＳの運営支援・投稿監視が主力。受託開発も
0,3776,ブロードバンドタワー,2,24,100,http://www.bbtower.co.jp/,2000-02-09,2005-08-03,6,都市型データセンター運用が主力。ECシステム構築など。ファッション通販の支援・企画も。\n都市型データセンターを運用。子会社でファッション通販支援やファッション企画も展開
0,3777,ジオネクスト,3,24,100,http://www.geo-nx.com/,1995-07-13,2005-09-15,12,リナックスOSなどの開発・販売・サポート。復興事業から撤退。再生エネなどに参入。\nＬｉｎｕｘＯＳ等のＩＴ関連、ビルメンテが柱。復興事業撤退し、再生エネ、薬局に進出し再建中
0,3778,さくらインターネット,4,24,100,http://www.sakura.ad.jp/,1999-08-17,2005-10-12,3,データセンター運営大手。ホスティング・クラウドサービス主体。東阪、石狩にセンター建設。\nデータセンター運営の業界大手。東阪に加え、石狩にもセンター建設。０８年、双日の傘下に
0,3779,Ｊエスコム,2,24,100,http://www.j-escom.co.jp/,2005-10-03,2005-10-03,3,理美容事業者向けに商材の販売など。広告代理や教育コンサルも。通販に参入。\n傘下に理美容業向け商材販売、広告代理、教育コンサル。通販など個人向け市場進出を模索中
0,3782,ディー・ディー・エス,4,24,100,http://www.dds.co.jp/,1998-01-01,2005-11-28,12,指紋認証ソフト・機器の開発会社。独自の技術に強み。NTT、自治体に実績。\n指紋認証ソフト・装置の開発会社。ＮＴＴ、自治体に実績。受託開発撤退、香港ＷＷＴＴと親密
0,3784,ヴィンクス,2,24,100,http://www.vinx.co.jp/,1991-02-20,2005-12-02,3,流通向けシステム・ソフトを開発。イオングループ関連の取引が主体。海外展開。\n小売り、流通向けソフトを開発。イオン関連取引が柱。同じ富士ソフト傘下企業と１３年に合併
0,3785,エイティング,4,24,100,http://www.8ing.co.jp/,1993-11-01,2005-12-07,9,ゲームソフトの受託開発。交流ゲームなどの自社コンテンツ・キャラクター開発なども。\nゲームソフト受託開発。携帯電話向けオリジナルゲームやキャラクター開発も。開発効率に強み
0,3787,テクノマセマティカル,4,24,100,http://www.tmath.co.jp/,2000-06-20,2005-12-14,3,ソフト、ハードウエアの開発・販売。画像圧縮ソフトでの独自技術と音声処理に定評。\n独自開発の圧縮技術による画像、音声処理に優れる。ソフト、ハードウエアの開発、販売が中心
0,3788,ＧＭＯクラウド,0,24,100,http://ir.gmocloud.com/,1997-05-01,2005-12-16,12,サーバー管理と電子認証提供が２本柱。電子認証の海外展開急ぐ。GMO傘下。\nＧＭＯ傘下。ホスティング（サーバー管理）と電子認証提供が両輪。電子認証は国際展開急ピッチ
0,3791,ＩＧポート,2,24,100,http://www.igport.co.jp/,1990-06-05,2005-12-21,5,アニメ企画・制作と版権収入が主体。CGアニメに強み。子会社にコミック専門出版社。\n映画、テレビ、ＤＶＤ等向けアニメ制作と版権収入が主柱。子会社にコミック専門出版社も
0,3793,ドリコム,4,24,100,http://www.drecom.co.jp/,2003-03-24,2006-02-09,3,ソーシャルゲームを軸に携帯コンテンツ・広告を展開。ブログシステムは撤退。楽天と提携。\nブログシステムから携帯コンテンツ、モバイルゲームに展開。楽天と０８年４月資本・業務提携
0,3794,エヌ・デーソフトウェア,1,24,100,http://www.ndsoft.jp/,1979-09-01,2006-02-08,3,介護・福祉関連ソフトで首位級。施設向け業務支援ソフトが主力。医療系ソフトも。\n介護・福祉分野に特化したソフトウエア会社。業界トップクラス。医療系ソフトにも展開
0,3796,いい生活,4,24,100,http://www.e-seikatsu.info/,2000-01-21,2006-02-16,3,不動産業界向けシステムを販売。物件情報のデータベースなどクラウドで提供。\n不動産会社支援システムを販売。物件データベースなどクラウドで提供。ヤフーとの提携縮小
0,3798,ＵＬＳグループ,2,24,100,http://www.ulsgroup.co.jp/,2000-07-25,2006-02-21,3,ITシステムの設計・構築・コンサルを展開。流通・製造業向けなどが中心。\nＩＴシステムのコンサル、設計、構築担う。流通、製造、情報サービス向けに強み。ＳＩ企業と合併
0,3799,キーウェア,1,24,100,http://www.keyware.co.jp/,1965-05-11,2006-06-07,3,総合基幹業務システムサービス。インフラ関連が主体。NECが筆頭株主で依存度大。\n総合システムサービス。ＮＥＣと密接。インフラ関連のシステム開発・構築、運用保守。ＥＲＰも
0,3800,ユニリタ,2,24,100,http://www.unirita.co.jp/,1982-05-24,2006-03-15,3,独立系のソフト開発・販売会社。基幹業務システム向けから分散処理向けにシフト。\n独立系ソフト開発会社。メインフレームからオープン系までカバー。１５年にビーコンＩＴと合併
0,3802,エコミック,7,24,0,http://www.ecomic.jp/,1997-04-01,2006-04-04,3,企業の給与計算代行などBPOが主体。北海道地盤で札幌と中国現法で処理。\nキャリアバンク子会社。給与計算受託。道外企業からの受注が主。札幌と中国・青島現法で処理
0,3803,イメージ情報開発,3,24,100,http://www.image-inf.co.jp/,1975-10-16,2006-04-21,3,戦略立案から保守までＳＩの一括受注が主柱。スマホ向け開発事業に進出。\nイメージデータ処理から出発。柱はＳＩ。ニッチ向けパッケージ強化。スマホ向け開発事業進出
0,3804,システム　ディ,2,24,100,http://www.systemd.co.jp/,1982-04-28,2006-04-27,10,業務ソフトの開発・販売。学校法人向けに特化。スポーツクラブ向け管理ソフトも。\n特定業種特化のソフトを開発販売。大学用と健康クラブ用の管理ソフトが２本柱。自治体開拓中
0,3807,フィスコ,3,24,100,http://www.fisco.co.jp/,1995-05-15,2006-06-08,12,情報ベンダー中心に金融情報提供。傘下にネット旅行、企業調査、広告代理業。\n金融関連情報をネットで提供。Ｍ＆Ａで事業多角化、企業調査やコンサル、ネット旅行業も育成
0,3808,オウケイウェイヴ,10,24,0,http://www.okwave.co.jp/,2000-02-01,2006-06-20,6,質問・回答サイト「OKWave」を運営。企業にシステムも提供。ポータルサイトの運営も。\n利用者同士が質問・回答するＱ＆Ａサイト「ＯＫＷａｖｅ」を運営。企業にシステムも提供
0,3810,サイバーステップ,4,24,100,http://www.cyberstep.com/,2001-08-13,2006-07-05,5,PCオンラインゲーム開発大手。格闘ゲームに強み。韓国で人気。課金収入が収益源。\nＰＣオンラインゲーム大手。「ゲットアンプド」など、自社サイト運営による課金収入が収益柱
0,3811,ビットアイル,0,24,100,http://www.bit-isle.jp/,2000-06-14,2006-07-19,7,データセンターを運営。自社設備に強み。ネット接続や運用支援なども。\n都市型データセンター運営。寺田倉庫、自社物件活用の自前設備に強み。運用・ＳＩサービスも
0,3814,アルファクス,3,24,100,http://www.afs.co.jp/,1993-12-09,2006-09-15,9,注文システムなど外食向け情報サービス。経営コスト改善ソフトを提供。新業態開拓。\nＰＯＳ、注文装置など外食の情報サービス。総菜や持ち帰り業態など開拓。内紛で経営混乱中
0,3815,メディア工房,4,24,100,http://www.mkb.ne.jp/,2000-04-13,2006-09-15,8,占いコンテンツを提供。海外にも配信。ゲームに参入、物販事業も。\n携帯やＰＣ向け占いコンテンツ配信が主力。海外も配信。ゲームに参入。アパレル等物販事業も
0,3816,大和コンピューター,2,24,100,http://www.daiwa-computer.co.jp/,1977-06-17,2006-09-29,7,ソフト開発会社。基幹業務などに強み。導入コンサルも。顧客に大塚商会、SCSK。\n基幹系業務ソフトの２次請け開発会社。大塚商会とＳＣＳＫ（旧住商情報システム）が２大顧客
0,3817,ＳＲＡホールディングス,0,24,100,http://www.sra-hd.co.jp/,2006-05-01,2006-09-30,3,独立系のシステム開発会社。金融、製造向けに強み。海外へ積極展開。\n独立系のシステム開発一括受託会社。Ｌｉｎｕｘ等オープンソース系に強い。海外展開積極化
0,3822,Ｍｉｎｏｒｉ,1,24,100,http://www.minori-sol.jp/,1980-06-11,2006-10-16,3,独立系システム開発会社。基幹・情報系に強み。運用も。三菱系に実績。\n独立系システム開発会社。基幹・Ｗｅｂ系に強み。イーウェーヴとの合併で誕生。三菱系に実績
0,3823,アクロディア,4,24,100,http://www.acrodea.co.jp/,2004-07-12,2006-10-19,8,携帯電話ソフトを開発。ライセンス販売が主力。スマホゲームに注力。海外に展開。\n携帯用入力ソフト（ＵＩ）の開発会社。スマホゲームにも注力。ＥＣサイト支援の持分会社は売却
0,3824,メディアファイブ,12,24,0,http://www.media5.co.jp/,1997-08-01,2006-10-25,5,IT技術者派遣や業務支援。未経験から自社育成。ソフトの受託開発なども。\nコンピュータ会社に自社で育成したＳＥ等を派遣し業務支援。ソフト受託開発も。福岡地盤
0,3825,リミックスポイント,4,24,100,http://www.remixpoint.co.jp/,2004-03-12,2006-12-01,3,中古車査定システムからエネルギー関連にシフト。電力管理事業、売電事業に進出。\n中古車査定システムを展開。１３年進出の電力管理事業に軸足移す。１４年には売電事業に進出
0,3826,システムインテグレータ,0,24,100,http://www.sint.co.jp/,1995-03-14,2006-12-04,2,独立系ソフト開発会社。ERPの開発請負、パッケージソフトの販売が２本柱。\n独立系ソフトハウス。ＥＲＰの請負開発とＷｅｂ関連中心のパッケージソフト販売・保守が両輪
0,3828,ニフティ,1,24,100,http://www.nifty.co.jp/,1986-02-04,2006-12-07,3,富士通系のネット接続大手。「@nifty」を展開。クラウドサービス強化、モバイルも育成。\n富士通子会社。ネット接続「＠ｎｉｆｔｙ」展開。クラウド事業に加えモバイル事業も育成中
